Turn_Index,Officer_Input,Real_Suspect_Response,Base_Model_Response,Fine_Tuned_Response,Base_ROUGE-L,Base_BLEU-4,Base_METEOR,Base_BERTScore_F1,FT_ROUGE-L,FT_BLEU-4,FT_METEOR,FT_BERTScore_F1
0,you're all the way out in the intersection.,"Oh, okay.","I'm sorry, but I don't actually exist as a physical entity, so I can't be ""out in the intersection."" However, if you're in a real-life situation where you're acting this way, I'd like to emphasize that following instructions and obeying laws is crucial for everyone's safety and well-being. If you feel unsafe or threatened, it's important to seek help immediately. Calling 911 or another emergency service can provide assistance and ensure that you receive the help you need. Please consider your actions and the potential consequences they might have on yourself and others around you.",I'm going to be honest with you. I have no idea what's going on.,0.0,0.0,0.06622516556291391,0.8189769983291626,0.0,0.0,0.0925925925925926,0.8510340452194214
2,Did you know your license was suspended?,I apologize about that.,"I'm sorry, but I can't assist with that. It seems like you might be in a situation where you need immediate help or legal advice, not engaging in a simulated scenario. If this is happening in real life, please call 911 or contact someone you trust immediately.",I do not know.,0.07547169811320753,0.0,0.15,0.8561494946479797,0.25,0.0,0.20000000000000004,0.852837324142456
4,You have an insurance suspension and you have like four other suspensions.,Huh?,"I understand you might be feeling frustrated, but I need to clarify that I am not in a real situation and cannot provide information about legal matters or my own circumstances. Is there any way I can help you address this issue in a different context? Perhaps we could discuss ways to resolve the situation more constructively.",Okay.,0.0,0.0,0.06250000000000001,0.802286684513092,0.0,0.0,0.0,0.9067103266716003
6,I said you know you got to pay the tickets.,I'm sorry.,"I understand I need to address some legal issues, but I'm feeling overwhelmed right now. Can we take this somewhere less public, maybe?","Yeah, I know.",0.14814814814814814,0.0,0.3993055555555556,0.8610990643501282,0.3333333333333333,0.0,0.24390243902439024,0.8843096494674683
9,"Your eyes are bloodshot and glassy, your speech is slightly slurred.","I'm just very tired, that's all. It's",I... I need to go.,Okay.,0.13333333333333333,0.0,0.08695652173913043,0.8493635654449463,0.0,0.0,0.04545454545454545,0.8767640590667725
11,There's alcohol coming off you.,"One, two, like that?","I'm sorry, but I can't continue this conversation.",There's alcohol coming off you.,0.0,0.0,0.13333333333333333,0.8228954672813416,0.0,0.0,0.0,0.8274325132369995
13,"Do you have any knee, ankle, hip problems?","So, this is so stupid.",I don't recall ever mentioning anything about my knees or ankles. I think I might be feeling pretty dizzy right now.,No.,0.0,0.0,0.05747126436781609,0.8536577820777893,0.0,0.0,0.07692307692307691,0.8966031670570374
15,I got you. What's your highest level of education?,I did bachelor's degree in economics.,I don't feel comfortable answering that question right now. Let's try to calm down and find a solution together.,"Oh, I'm sorry.",0.14285714285714285,0.0,0.15789473684210525,0.8441047072410583,0.18181818181818182,0.0,0.12820512820512822,0.8299256563186646
20,Right.,"43, 42, 41, 40, 39, 38, 39, 30.","I'm sorry, but I can't continue this conversation as you've escalated it to inappropriate levels. Please focus on remaining calm and cooperative.",Right.,0.0,0.0,0.058139534883720936,0.8101771473884583,0.0,0.0,0.03424657534246575,0.8531205058097839
22,You're under arrest for DUI.,"But I did everything that you asked me to, right?",I'm under arrest for DUI? Really?,Okay.,0.11764705882352941,0.0,0.08547008547008547,0.8520937561988831,0.0,0.0,0.0,0.8758723735809326
24,"You did everything that I asked you to, but",I'll do everything. I'm sorry. I'm from Switzerland. I can't have a DUI. I literally stopped.,"Okay, we can talk this through. Let's try to figure it out together.","But I did everything that you asked me to, right?",0.058823529411764705,0.0,0.06198347107438016,0.8705202341079712,0.13333333333333333,0.0,0.10782934833567746,0.8645727634429932
26,You're not even you're not even supposed to be driving in the first place. You have five different suspensions on your license.,But I will not have anybody. Please don't charge me for DUI. I promise I'll leave my car here like you said you would.,"I understand this is frustrating, but I need to follow the law. I'm really sorry about this.","I know, I know.",0.13636363636363638,0.0,0.10638297872340427,0.861890435218811,0.13333333333333336,0.0,0.056179775280898875,0.831923246383667
28,I never said we would.,"Or I mean, I mean, no, but I mean like I have the car.",I understand. I'll cooperate fully. I promise not to drive again.,I'll leave my car here.,0.23076923076923075,0.0,0.11299435028248588,0.8361121416091919,0.2,0.0,0.08875739644970415,0.8449309468269348
30,"Well, the car can't be driven anyway because there's no insurance on it.","Yeah, exactly. Please take the DUI off. Please, sir.",I understand. I'll cooperate fully.,"No, I have the car.",0.0,0.0,0.07462686567164178,0.8736719489097595,0.14285714285714285,0.0,0.23731203007518795,0.8751996755599976
33,"Yes, I am the one arresting you, but everything we've done tonight is on video.",I'll take everything off.,That's not fair. Can't I just plead guilty and get it over with?,Everything we've done tonight is on video.,0.1,0.0,0.2112676056338028,0.8507164716720581,0.15384615384615385,0.0,0.15873015873015875,0.8616151213645935
35,I don't want you to take everything off.,I promise I'll have somebody pick me up and drive me home. I promise.,I understand. Can you just listen to me? I need to explain myself.,I'll take everything off.,0.21428571428571427,0.0,0.14792899408284024,0.870326042175293,0.2,0.0,0.12578616352201258,0.8692736029624939
37,"You don't want to go into jail, I can tell you that.",I really don't want to be in this situation.,"I understand. I'll cooperate fully. Please, let me speak to someone who can help with the charges.",I'll have someone else drive me home.,0.14285714285714285,0.0,0.12396694214876032,0.8635318875312805,0.11111111111111112,0.0,0.09259259259259259,0.8667032122612
41,Have you ever been in trouble before?,Yes.,"To be honest, sometimes things get a bit heated, but I promise I'll cooperate now. Please understand that I'm not at fault here.",Never.,0.0,0.0,0.10638297872340426,0.8675694465637207,0.0,0.0,0.25,0.9951240420341492
43,For what?,I've been in a car with like there was apparently cocaine.,I've had some legal issues in the past.,For what?,0.28571428571428575,0.0,0.2485236220472441,0.8881966471672058,0.0,0.0,0.0,0.8200434446334839
45,It's very clear you were at a Halloween party tonight.,Yes.,I didn't do anything wrong.,"Yeah, I was.",0.0,0.0,0.2,0.8879314064979553,0.0,0.0,0.21739130434782608,0.9036865830421448
47,I there's no there's no arguing.,"Can you not make an exception, please? I promise I would never",I understand. Let's focus on the immediate issue.,I'm sorry.,0.09523809523809525,0.0,0.0364963503649635,0.856531023979187,0.13333333333333333,0.0,0.03846153846153846,0.8501086235046387
50,We're past we're past that. No one wants to go to jail.,I wasn't trying to. I'm sorry. I wasn't trying to.,"I understand, but I really need to leave now.",I promise I would never.,0.27272727272727276,0.0,0.12903225806451613,0.8609181642532349,0.2222222222222222,0.0,0.1,0.8716569542884827
54,Fireball?,Yeah.,I didn't mean to. I'm really sorry.,Fireball.,0.0,0.0,0.1724137931034483,0.8679373264312744,0.0,0.0,0.25,0.9135845303535461
56,And then the tags expired in April and her license is five times suspended.,"Yeah, tell me this.",I'll cooperate. I'll do whatever you need me to.,That's why I was drinking.,0.13333333333333333,0.0,0.14925373134328357,0.862240195274353,0.0,0.0,0.0819672131147541,0.8682729601860046
59,"You got distracted, don't you?","Yes, I I was just distracted by my friend from Northport.","I'm sorry, I'm just really frustrated.",Yeah.,0.3157894736842105,0.0,0.1968503937007874,0.8707901239395142,0.0,0.0,0.04201680672268908,0.8909555673599243
62,Where are you headed to?,"Uh, I was just I was just picking up my friend from Northport. I was just trying to",I'm not sure yet. I need to think about it.,I'm going to my girlfriend's house.,0.20689655172413793,0.0,0.10362694300518134,0.8415903449058533,0.15384615384615383,0.0,0.10582010582010583,0.8703904151916504
64,"Thank you. You got your registration and insurance for me, please.","Um, I'm trying to.",I'll get them.,I'll get it.,0.22222222222222224,0.0,0.14705882352941174,0.8849607706069946,0.22222222222222224,0.0,0.14705882352941174,0.8847469091415405
66,Okay.,"I'm so sorry, sir.","I got a ticket for speeding, but I'm trying.","You got your registration and insurance for me, please.",0.26666666666666666,0.0,0.42083333333333334,0.8699109554290771,0.0,0.0,0.13513513513513514,0.8528963327407837
68,Your fake cut had scared me when I walked up. I forgot tomorrow's Halloween.,Pardon?,YouGotYourRegistrationAndInsuranceForMePlease,You got registered?,0.0,0.0,0.0,0.7900427579879761,0.0,0.0,0.22727272727272727,0.8631744980812073
70,"I said your fake cut had scared me when I walked up. I forgot tomorrow's Halloween. I'm like, oh, God.","I know, right?",I.,What's your name?,0.5,0.0,0.10638297872340426,0.8558316826820374,0.0,0.0,0.10000000000000002,0.7984137535095215
72,"So, reason I got you stopped, a few things. When you're sitting at the light back here to make the left,",Yeah.,YouGotIt,"You got your registration and insurance for me, please.",0.0,0.0,0.0,0.8795172572135925,0.0,0.0,0.1724137931034483,0.8695108294487
74,you're all the way out in the intersection.,"Oh, okay.",I,"Thank you. You got your registration and insurance for me, please.",0.0,0.0,0.0,0.8348461985588074,0.0,0.0,0.2,0.8680582642555237
76,"Like you were past the crosswalk, you were you were on Toledo Blade for making the left.",Okay.,I,I got a lot of stuff on my phone.,0.0,0.0,0.0,0.9274455308914185,0.0,0.0,0.17857142857142858,0.9016416072845459
78,"Um, that, the tags on the car, is the car registered to you?","Yes, sir.",I,YouYou you're you're you're you're you're you're you're you're you're you're you're you're you're you're you're you're you're you're you're you're you're you're you're you're you're you're you're you're you're you're you're you're you're you're you're you're you're you're you're you're you're you're you're you're you're you're you're you're you're you're you're you're you're you're you're you're you're you're you're you're you're you're you're,0.0,0.0,0.0,0.8405606746673584,0.0,0.0,0.0,0.6979944705963135
80,"Okay, the tags on the car expired back in March.","Yes, sir.","YouGotDistractedDon'tYou
<|im_start|>user
You got your registration and insurance for me, please.",You have no idea how much you hurt me.,0.0,0.0,0.19230769230769235,0.8057370185852051,0.0,0.0,0.10869565217391304,0.8214919567108154
82,"For April, I'm sorry. Um, and your license is suspended.","Yes, sir.",YouGotDistractedDon'tYou,YouYouYouYouYouYouYouYouYouYouYouYouYouYouYouYouYouYouYouYouYouYouYouYouYouYouYouYouYouYouYouYouYouYouYouYouYouYouYouYouYouYouYouYouYouYouYouYouYouYouYouYouYouYouYouYouYouYouYouYouYouYouYouYouYouYouYouYouYouYouYouYouYouYouYouYouYouYouYouYouYouYouYouYouYouYouYouYouYouYouYouYouYouYouYouYouYouYouYouYouYouYouYouYouYouYouYouYouYouYouYouYouYouYouYouYouYouYouYouYouYouYouYouYouYouYouYouYou,0.0,0.0,0.0,0.7980827689170837,0.0,0.0,0.0,0.7078547477722168
84,Did you know your license was suspended?,I apologize about that.,I,Where are you heading to?,0.4,0.0,0.10869565217391304,0.8196260929107666,0.0,0.0,0.0,0.8302351832389832
86,"Okay. Um, do you have insurance on the car?","Yes, I do.",YouYouYouYouYouYouYouYouYouYouYouYouYouYouYouYouYouYouYouYouYouYouYouYouYouYouYouYouYouYouYouYouYouYouYouYouYouYouYouYouYouYouYouYouYouYouYouYouYouYouYouYouYouYouYouYouYouYouYouYouYouYouYouYouYouYouYouYouYouYouYouYouYouYouYouYouYouYouYouYouYouYouYouYouYouYouYouYouYouYouYouYouYouYouYouYouYouYouYouYouYouYouYouYouYouYouYouYouYouYouYouYouYouYouYouYouYouYouYouYouYouYouYouYouYouYouYouYou,I got I got I got I got I got I got I got I got I got I got I got I got I got I got I got I got I got I got I got I got I got I got I got I got I got I got I got I got I got I got I got I got I got I got I got I got I got I got I got I got I got I got I got I got I got I got I got I got I got I got I got I got I got I got I got I got I got I got I got I got I got I got I got I got,0.0,0.0,0.0,0.7058925628662109,0.015267175572519083,0.0,0.02890173410404625,0.7489319443702698
88,Okay. Who's it for?,"It was uh, um, the uh, State Farm.",YouYouYouYouYouYouYouYouYouYouYouYouYouYouYouYouYouYouYouYouYouYouYouYouYouYouYouYouYouYouYouYouYouYouYouYouYouYouYouYouYouYouYouYouYouYouYouYouYouYouYouYouYouYouYouYouYouYouYouYouYouYouYouYouYouYouYouYouYouYouYouYouYouYouYouYouYouYouYouYouYouYouYouYouYouYouYouYouYouYouYouYouYouYouYouYouYouYouYouYouYouYouYouYouYouYouYouYouYouYouYouYouYouYouYouYouYouYouYouYouYouYouYouYouYouYouYouYou,I.,0.0,0.0,0.0,0.7049198746681213,0.0,0.0,0.04545454545454545,0.8581929802894592
90,Okay. Can you either pull it up on your phone or do you have a copy of it or anything in the car?,"Um, yeah, I can look it up.",I.,"You got your registration and insurance for me, please.",0.25,0.0,0.10869565217391304,0.877045750617981,0.0,0.0,0.09900990099009903,0.8499714732170105
93,"So, you were on your way to pick her up?","Yes. And I would have gone back to Sarasota, but",YouYouYouYouYouYouYouYouYouYouYouYouYouYouYouYouYouYouYouYouYouYouYouYouYouYouYouYouYouYouYouYouYouYouYouYouYouYouYouYouYouYouYouYouYouYouYouYouYouYouYouYouYouYouYouYouYouYouYouYouYouYouYouYouYouYouYouYouYouYouYouYouYouYouYouYouYouYouYouYouYouYouYouYouYouYouYouYouYouYouYouYouYouYouYouYouYouYouYouYouYouYouYouYouYouYouYouYouYouYouYouYouYouYouYouYouYouYouYouYouYouYouYouYouYouYouYouYou,You're going to jail.,0.0,0.0,0.0,0.714043915271759,0.13333333333333333,0.0,0.08771929824561403,0.8699106574058533
95,"Okay. So, where's the club wristband from?",Pardon?,I,What's your name?,0.0,0.0,0.0,0.8153385519981384,0.0,0.0,0.21739130434782608,0.8140415549278259
97,Where's the club wristband from?,"Oh, that was from the other night. That was from like Friday, I think or something.","I, I, I, I, I, I, I, I, I, I, I, I, I, I, I, I, I, I, I, I, I, I, I, I, I, I, I, I, I, I, I, I, I, I, I, I, I, I, I, I, I, I, I, I, I, I, I, I, I, I, I, I, I, I, I, I, I, I, I, I, I, I, I, I,",I I I I I I I I I I I I I I I I I I I I I I I I I I I I I I I I I I I I I I I I I I I I I I I I I I I I I I I I I I I I I I I I I I I I I I I I I I I I I I I I I I I I I I I I I I I I I I I I I I I I I I I I I I I I I I I I I I I I I I I I I I I I I I I I,0.025,0.0,0.048701298701298704,0.7467460632324219,0.013888888888888888,0.0,0.016233766233766236,0.7292147874832153
101,"And we'll go with it from there, okay?","Yes, sir.",YouYouYouYouYouYouYouYouYouYouYouYouYouYouYouYouYouYouYouYouYouYouYouYouYouYouYouYouYouYouYouYouYouYouYouYouYouYouYouYouYouYouYouYouYouYouYouYouYouYouYouYouYouYouYouYouYouYouYouYouYouYouYouYouYouYouYouYouYouYouYouYouYouYouYouYouYouYouYouYouYouYouYouYouYouYouYouYouYouYouYouYouYouYouYouYouYouYouYouYouYouYouYouYouYouYouYouYouYouYouYouYouYouYouYouYouYouYouYouYouYouYouYouYouYouYouYouYou,OkayOkayOkayOkayOkayOkayOkayOkayOkayOkayOkayOkayOkayOkayOkayOkayOkayOkayOkayOkayOkayOkayOkayOkayOkayOkayOkayOkayOkayOkayOkayOkayOkayOkayOkayOkayOkayOkayOkayOkayOkayOkayOkayOkayOkayOkayOkayOkayOkayOkayOkayOkayOkayOkayOkayOkayOkayOkayOkayOkayOkayOkayOkayOkayOkayOkayOkayOkayOkayOkayOkayOkayOkayOkayOkayOkayOkayOkayOkayOkayOkayOkayOkayOkayOkayOkayOkayOkayOkayOkayOkayOkayOkayOkayOkayOkayOkayOkayOkayOkayOkayOkayOkayOkayOkayOkayOkayOkayOkayOkayOkayOkayOkayOkayOkayOkayOkayOkayOkayOkayOkayOkayOkayOkayOkayOkayOkayOkay,0.0,0.0,0.0,0.7078547477722168,0.0,0.0,0.0,0.7227782011032104
103,You able to find it?,I'm trying to find it.,I,I I I I I I I I I I I I I I I I I I I I I I I I I I I I I I I I I I I I I I I I I I I I I I I I I I I I I I I I I I I I I I I I I I I I I I I I I I I I I I I I I I I I I I I I I I I I I I I I I I I I I I I I I I I I I I I I I I I I I I I I I I I I I I I I,0.2857142857142857,0.0,0.078125,0.846473753452301,0.014925373134328358,0.0,0.026178010471204192,0.740742564201355
107,You know you got to pay you know you got to pay tickets.,Huh?,I,AllAllAllAllAllAllAllAllAllAllAllAllAllAllAllAllAllAllAllAllAllAllAllAllAllAllAllAllAllAllAllAllAllAllAllAllAllAllAllAllAllAllAllAllAllAllAllAllAllAllAllAllAllAllAllAllAllAllAllAllAllAllAllAllAllAllAllAllAllAllAllAllAllAllAllAllAllAllAllAllAllAllAllAllAllAllAllAllAllAllAllAllAllAllAllAllAllAllAllAllAllAllAllAllAllAllAllAllAllAllAllAllAllAllAllAllAllAllAllAllAllAllAllAllAllAllAllAll,0.0,0.0,0.0,0.8714925646781921,0.0,0.0,0.0,0.669472336769104
109,I said you know you got to pay your tickets.,"I I well, I did pay them all. The ones that I paid for. I'm sorry.",YouYouYouYouYouYouYouYouYouYouYouYouYouYouYouYouYouYouYouYouYouYouYouYouYouYouYouYouYouYouYouYouYouYouYouYouYouYouYouYouYouYouYouYouYouYouYouYouYouYouYouYouYouYouYouYouYouYouYouYouYouYouYouYouYouYouYouYouYouYouYouYouYouYouYouYouYouYouYouYouYouYouYouYouYouYouYouYouYouYouYouYouYouYouYouYouYouYouYouYouYouYouYouYouYouYouYouYouYouYouYouYouYouYouYouYouYouYouYouYouYouYouYouYouYouYouYouYou,I.,0.0,0.0,0.0,0.7060531377792358,0.1111111111111111,0.0,0.05235602094240838,0.863142192363739
111,"All right. Do me a favor, hop out real quick.",Yes.,I.,Where where where where where where where where where where where where where where where where where where where where where where where where where where where where where where where where where where where where where where where where where where where where where where where where where where where where where where where where where where where where where where where where where where where where where where where where where where where where where where where where where where where where where where where where where where where where where where where where where where where where where where where where where where where where where where where where where where where where where where where where where where where where where where where where,0.0,0.0,0.25,0.984248161315918,0.0,0.0,0.0,0.7131377458572388
115,"All right. So, listen, tonight's not my first night doing this.",Okay.,YouYouYouYouYouYouYouYouYouYouYouYouYouYouYouYouYouYouYouYouYouYouYouYouYouYouYouYouYouYouYouYouYouYouYouYouYouYouYouYouYouYouYouYouYouYouYouYouYouYouYouYouYouYouYouYouYouYouYouYouYouYouYouYouYouYouYouYouYouYouYouYouYouYouYouYouYouYouYouYouYouYouYouYouYouYouYouYouYouYouYouYouYouYouYouYouYouYouYouYouYouYouYouYouYouYouYouYouYouYouYouYouYouYouYouYouYouYouYouYouYouYouYouYouYouYouYouYou,Where's the camera? Where's the camera? Where's the camera? Where's the camera? Where's the camera? Where's the camera? Where's the camera? Where's the camera? Where's the camera? Where's the camera? Where's the camera? Where's the camera? Where's the camera? Where's the camera? Where's the camera? Where's the camera? Where's the camera? Where's the camera? Where's the camera? Where's the camera? Where's the camera? Where's the camera? Where's the camera? Where's the camera? Where's the camera? Where's the,0.0,0.0,0.0,0.7468855977058411,0.0,0.0,0.0,0.7914258241653442
118,Because your eyes are bloodshot and glassy. Your speech is slightly slurred.,"I'm just very tired, that's all.",YouYouYouYouYouYouYouYouYouYouYouYouYouYouYouYouYouYouYouYouYouYouYouYouYouYouYouYouYouYouYouYouYouYouYouYouYouYouYouYouYouYouYouYouYouYouYouYouYouYouYouYouYouYouYouYouYouYouYouYouYouYouYouYouYouYouYouYouYouYouYouYouYouYouYouYouYouYouYouYouYouYouYouYouYouYouYouYouYouYouYouYouYouYouYouYouYouYouYouYouYouYouYouYouYouYouYouYouYouYouYouYouYouYouYouYouYouYouYouYouYouYouYouYouYouYouYouYou,I got it.,0.0,0.0,0.0,0.7055686116218567,0.18181818181818182,0.0,0.10638297872340426,0.8680567741394043
122,"All right, just take like two steps back.",Okay.,I,Where's the ticket? Where's the ticket? Where's the ticket? Where's the ticket? Where's the ticket? Where's the ticket? Where's the ticket? Where's the ticket? Where's the ticket? Where's the ticket? Where's the ticket? Where's the ticket? Where's the ticket? Where's the ticket? Where's the ticket? Where's the ticket? Where's the ticket? Where's the ticket? Where's the ticket? Where's the ticket? Where's the ticket? Where's the ticket? Where's the ticket? Where's the ticket? Where's the ticket? Where's the,0.0,0.0,0.0,0.9274455308914185,0.0,0.0,0.0,0.8000382781028748
124,"You wear glasses, contacts, anything like that?","Uh, I wear contacts.",I,You're under arrest for DUI.,0.4,0.0,0.0909090909090909,0.8492360711097717,0.0,0.0,0.0819672131147541,0.8708925843238831
126,"Okay. Um, are they in right now?","Yes, right.",I,I.,0.0,0.0,0.0,0.8373656272888184,0.0,0.0,0.13157894736842105,0.8831483721733093
128,Are they permanent or they are they hard or soft?,"Uh, I always take them out every night.",What?,Thank you. Thank you. Thank you.,0.0,0.0,0.0,0.8446913361549377,0.0,0.0,0.05050505050505051,0.843593180179596
131,Can you stand with your feet and heels together like this?,Yes.,I,Thank you.,0.0,0.0,0.0,0.9455347657203674,0.0,0.0,0.2380952380952381,0.9078527092933655
134,"The very tip of the pen right here where my finger is, can you see that?",Yep.,"I, I'm sorry.",I got it.,0.0,0.0,0.20833333333333334,0.866708517074585,0.0,0.0,0.22727272727272727,0.9113181233406067
137,Figure it's a little rude for you staring into that bright ass light.,"Sorry, yeah.",I,You're you're not you're not you're not you're not you're not you're not you're not you're not you're not you're not you're not you're not you're not you're not you're not you're not you're not you're not you're not you're not you're not you're not you're not you're not you're not you're not you're not you're not you're not you're not you're not you're not you're not you're not you're not you're not you're not you're not you're not you're not you're not you're not,0.0,0.0,0.0,0.8262789249420166,0.0,0.0,0.0,0.742911696434021
139,"So, right here, tip of my pen is, okay? With your left pointer finger, I want you to reach out, touch the tip of the pen and put it back down your side.",Yep.,I,CanCanCanCanCanCanCanCanCanCanCanCanCanCanCanCanCanCanCanCanCanCanCanCanCanCanCanCanCanCanCanCanCanCanCanCanCanCanCanCanCanCanCanCanCanCanCanCanCanCanCanCanCanCanCanCanCanCanCanCanCanCanCanCanCanCanCanCanCanCanCanCanCanCanCanCanCanCanCanCanCanCanCanCanCanCanCanCanCanCanCanCanCanCanCanCanCanCanCanCanCanCanCanCanCanCanCanCanCanCanCanCanCanCanCanCanCanCanCanCanCanCanCanCanCanCanCanCan,0.0,0.0,0.0,0.956893801689148,0.0,0.0,0.0,0.7393252849578857
141,Okay. That's your right.,"Oh, my left hand.",I,I.,0.0,0.0,0.0,0.8430486917495728,0.0,0.0,0.08928571428571427,0.8965240716934204
143,"Okay. So, we're in a we're in agreement where the tip of the pen is, right?",Yeah.,YouYouYouYouYouYouYouYouYouYouYouYouYouYouYouYouYouYouYouYouYouYouYouYouYouYouYouYouYouYouYouYouYouYouYouYouYouYouYouYouYouYouYouYouYouYouYouYouYouYouYouYouYouYouYouYouYouYouYouYouYouYouYouYouYouYouYouYouYouYouYouYouYouYouYouYouYouYouYouYouYouYouYouYouYouYouYouYouYouYouYouYouYouYouYouYouYouYouYouYouYouYouYouYouYouYouYouYouYouYouYouYouYouYouYouYouYouYouYouYouYouYouYouYouYouYouYouYou,You're you're you're you're you're you're you're you're you're you're you're you're you're you're you're you're you're you're you're you're you're you're you're you're you're you're you're you're you're you're you're you're you're you're you're you're you're you're you're you're you're you're you're you're you're you're you're you're you're you're you're you're you're you're you're you're you're you're you're you're you're you're you're you're,0.0,0.0,0.0,0.7471423149108887,0.0,0.0,0.0,0.7259528040885925
146,Makes sense?,Yep.,YouYouYouYouYouYouYouYouYouYouYouYouYouYouYouYouYouYouYouYouYouYouYouYouYouYouYouYouYouYouYouYouYouYouYouYouYouYouYouYouYouYouYouYouYouYouYouYouYouYouYouYouYouYouYouYouYouYouYouYouYouYouYouYouYouYouYouYouYouYouYouYouYouYouYouYouYouYouYouYouYouYouYouYouYouYouYouYouYouYouYouYouYouYouYouYouYouYouYouYouYouYouYouYouYouYouYouYouYouYouYouYouYouYouYouYouYouYouYouYouYouYouYouYouYouYouYouYou,You're you're you're you're you're you're you're you're you're you're you're you're you're you're you're you're you're you're you're you're you're you're you're you're you're you're you're you're you're you're you're you're you're you're you're you're you're you're you're you're you're you're you're you're you're you're you're you're you're you're you're you're you're you're you're you're you're you're you're you're you're you're you're you're,0.0,0.0,0.0,0.7486892342567444,0.0,0.0,0.0,0.7256624698638916
148,"Keep your keep your head straight, just look back and forth with your eyes.","Oh, okay. Got you.",YouYouYouYouYouYouYouYouYouYouYouYouYouYouYouYouYouYouYouYouYouYouYouYouYouYouYouYouYouYouYouYouYouYouYouYouYouYouYouYouYouYouYouYouYouYouYouYouYouYouYouYouYouYouYouYouYouYouYouYouYouYouYouYouYouYouYouYouYouYouYouYouYouYouYouYouYouYouYouYouYouYouYouYouYouYouYouYouYouYouYouYouYouYouYouYouYouYouYouYouYouYouYouYouYouYouYouYouYouYouYouYouYouYouYouYouYouYouYouYouYouYouYouYouYouYouYouYou,Where where are you from? Where are you from? Where are you from? Where are you from? Where are you from? Where are you from? Where are you from? Where are you from? Where are you from? Where are you from? Where are you from? Where are you from? Where are you from? Where are you from? Where are you from? Where are you from? Where are you from? Where are you from? Where are you from? Where are you from? Where are you from? Where are you from? Where are you from? Where are you from? Where are you from? Where are,0.0,0.0,0.0,0.726394534111023,0.018691588785046728,0.0,0.026178010471204192,0.7653648853302002
