Turn_Index,Officer_Input,Real_Suspect_Response,Base_Model_Response,Fine_Tuned_Response,Base_ROUGE-L,Base_BLEU-4,Base_METEOR,Base_BERTScore_F1,FT_ROUGE-L,FT_BLEU-4,FT_METEOR,FT_BERTScore_F1
151,"All right, move that for a second. So, how how comfortable is it to walk in those boots?","It's pretty okay, I guess.",I,I,0.2857142857142857,0.0,0.0684931506849315,0.8312655687332153,0.2857142857142857,0.0,0.0684931506849315,0.8312654495239258
153,Do you think you could walk a straight line in those boots or do you want to take the boots off and put slides or something else on or do it barefoot or it's up to you?,I I can try to walk a straight line.,YouYouYouYouYouYouYouYouYouYouYouYouYouYouYouYouYouYouYouYouYouYouYouYouYouYouYouYouYouYouYouYouYouYouYouYouYouYouYouYouYouYouYouYouYouYouYouYouYouYouYouYouYouYouYouYouYouYouYouYouYouYouYouYouYouYouYouYouYouYouYouYouYouYouYouYouYouYouYouYouYouYouYouYouYouYouYouYouYouYouYouYouYouYouYouYouYouYouYouYouYouYouYouYouYouYouYouYouYouYouYouYouYouYouYouYouYouYouYouYouYouYouYouYouYouYouYouYou,You got a problem with me?,0.0,0.0,0.0,0.7160290479660034,0.13333333333333333,0.0,0.05154639175257732,0.8456006050109863
155,"Okay. So, just take like four or five steps back.",Yep.,I,Thank you.,0.0,0.0,0.0,0.956893801689148,0.0,0.0,0.2380952380952381,0.8958901166915894
157,"No, and then right here, obviously you see this fog line right here?",Yep.,"I, C, D, E, F, G, H, I, J, K, L, M, N, O, P, Q, R, S, T, U, V, W, X, Y, Z.",What's your name?,0.0,0.0,0.0735294117647059,0.7995135188102722,0.0,0.0,0.0,0.8421593308448792
159,"What I want you to do is put your right foot in front of your left, touching heel to toe like this.",Like this?,YouYouYouYouYouYouYouYouYouYouYouYouYouYouYouYouYouYouYouYouYouYouYouYouYouYouYouYouYouYouYouYouYouYouYouYouYouYouYouYouYouYouYouYouYouYouYouYouYouYouYouYouYouYouYouYouYouYouYouYouYouYouYouYouYouYouYouYouYouYouYouYouYouYouYouYouYouYouYouYouYouYouYouYouYouYouYouYouYouYouYouYouYouYouYouYouYouYouYouYouYouYouYouYouYouYouYouYouYouYouYouYouYouYouYouYouYouYouYouYouYouYouYouYouYouYouYouYou,IICall for me.,0.0,0.0,0.0,0.7068235278129578,0.0,0.0,0.0,0.8355804085731506
161,Yes. Your right in front of your left.,Yes.,I.,YouYouYouYouYouYouYouYouYouYouYouYouYouYouYouYouYouYouYouYouYouYouYouYouYouYouYouYouYouYouYouYouYouYouYouYouYouYouYouYouYouYouYouYouYouYouYouYouYouYouYouYouYouYouYouYouYouYouYouYouYouYouYouYouYouYouYouYouYouYouYouYouYouYouYouYouYouYouYouYouYouYouYouYouYouYouYouYouYouYouYouYouYouYouYouYouYouYouYouYouYouYouYouYouYouYouYouYouYouYouYouYouYouYouYouYouYouYouYouYouYouYouYouYouYouYouYouYou,0.0,0.0,0.25,0.984248161315918,0.0,0.0,0.0,0.7480743527412415
171,Makes sense so far?,Yep.,YouYouYouYouYouYouYouYouYouYouYouYouYouYouYouYouYouYouYouYouYouYouYouYouYouYouYouYouYouYouYouYouYouYouYouYouYouYouYouYouYouYouYouYouYouYouYouYouYouYouYouYouYouYouYouYouYouYouYouYouYouYouYouYouYouYouYouYouYouYouYouYouYouYouYouYouYouYouYouYouYouYouYouYouYouYouYouYouYouYouYouYouYouYouYouYouYouYouYouYouYouYouYouYouYouYouYouYouYouYouYouYouYouYouYouYouYouYouYouYouYouYouYouYouYouYouYouYou,I.,0.0,0.0,0.0,0.7486892342567444,0.0,0.0,0.25,0.9919958114624023
174,Count out loud on every step.,Okay.,YouYouYouYouYouYouYouYouYouYouYouYouYouYouYouYouYouYouYouYouYouYouYouYouYouYouYouYouYouYouYouYouYouYouYouYouYouYouYouYouYouYouYouYouYouYouYouYouYouYouYouYouYouYouYouYouYouYouYouYouYouYouYouYouYouYouYouYouYouYouYouYouYouYouYouYouYouYouYouYouYouYouYouYouYouYouYouYouYouYouYouYouYouYouYouYouYouYouYouYouYouYouYouYouYouYouYouYouYouYouYouYouYouYouYouYouYouYouYouYouYouYouYouYouYouYouYouYou,YouYouYouYouYouYouYouYouYouYouYouYouYouYouYouYouYouYouYouYouYouYouYouYouYouYouYouYouYouYouYouYouYouYouYouYouYouYouYouYouYouYouYouYouYouYouYouYouYouYouYouYouYouYouYouYouYouYouYouYouYouYouYouYouYouYouYouYouYouYouYouYouYouYouYouYouYouYouYouYouYouYouYouYouYouYouYouYouYouYouYouYouYouYouYouYouYouYouYouYouYouYouYouYouYouYouYouYouYouYouYouYouYouYouYouYouYouYouYouYouYouYouYouYouYouYouYouYou,0.0,0.0,0.0,0.7468857169151306,0.0,0.0,0.0,0.7468855977058411
177,"Ninth step, turn around the way I showed you by taking those series of small steps.","Yeah, this is.",I,YouYouYouYouYouYouYouYouYouYouYouYouYouYouYouYouYouYouYouYouYouYouYouYouYouYouYouYouYouYouYouYouYouYouYouYouYouYouYouYouYouYouYouYouYouYouYouYouYouYouYouYouYouYouYouYouYouYouYouYouYouYouYouYouYouYouYouYouYouYouYouYouYouYouYouYouYouYouYouYouYouYouYouYouYouYouYouYouYouYouYouYouYouYouYouYouYouYouYouYouYouYouYouYouYouYouYouYouYouYouYouYouYouYouYouYouYouYouYouYouYouYouYouYouYouYouYouYou,0.0,0.0,0.0,0.854280948638916,0.0,0.0,0.0,0.7192872762680054
179,And then do nine steps back the same manner you took the first steps.,Okay.,YouYouYouYouYouYouYouYouYouYouYouYouYouYouYouYouYouYouYouYouYouYouYouYouYouYouYouYouYouYouYouYouYouYouYouYouYouYouYouYouYouYouYouYouYouYouYouYouYouYouYouYouYouYouYouYouYouYouYouYouYouYouYouYouYouYouYouYouYouYouYouYouYouYouYouYouYouYouYouYouYouYouYouYouYouYouYouYouYouYouYouYouYouYouYouYouYouYouYouYouYouYouYouYouYouYouYouYouYouYouYouYouYouYouYouYouYouYouYouYouYouYouYouYouYouYouYouYou,I.,0.0,0.0,0.0,0.7468857169151306,0.0,0.0,0.25,0.9666292071342468
181,Makes sense?,Yep.,YouYouYouYouYouYouYouYouYouYouYouYouYouYouYouYouYouYouYouYouYouYouYouYouYouYouYouYouYouYouYouYouYouYouYouYouYouYouYouYouYouYouYouYouYouYouYouYouYouYouYouYouYouYouYouYouYouYouYouYouYouYouYouYouYouYouYouYouYouYouYouYouYouYouYouYouYouYouYouYouYouYouYouYouYouYouYouYouYouYouYouYouYouYouYouYouYouYouYouYouYouYouYouYouYouYouYouYouYouYouYouYouYouYouYouYouYouYouYouYouYouYouYouYouYouYouYouYou,YouYouYouYouYouYouYouYouYouYouYouYouYouYouYouYouYouYouYouYouYouYouYouYouYouYouYouYouYouYouYouYouYouYouYouYouYouYouYouYouYouYouYouYouYouYouYouYouYouYouYouYouYouYouYouYouYouYouYouYouYouYouYouYouYouYouYouYouYouYouYouYouYouYouYouYouYouYouYouYouYouYouYouYouYouYouYouYouYouYouYouYouYouYouYouYouYouYouYouYouYouYouYouYouYouYouYouYouYouYouYouYouYouYouYouYouYouYouYouYouYouYouYouYouYouYouYouYou,0.0,0.0,0.0,0.7486892342567444,0.0,0.0,0.0,0.7486892342567444
183,"One last thing, once I tell you to begin the exercise, don't stop it until it's complete.",Okay.,I,I.,0.0,0.0,0.0,0.9274455308914185,0.0,0.0,0.25,0.9666292071342468
186,"All right, any questions?","And um, could I do it without the shoes too or no?","IİI, I'm sorry.","IIC, I'm at the 5200 block of West 1st Street. I'm at the 5200 block of West 1st Street.",0.11764705882352941,0.0,0.07575757575757576,0.8165080547332764,0.12121212121212123,0.0,0.09999999999999999,0.8131558299064636
188,Do you do you want to try it with the shoes or without?,I just I I don't know. I just prefer it without because they're really creepy. I just don't want you to,I,"You're not supposed to be driving, right?",0.07999999999999999,0.0,0.02127659574468085,0.7903405427932739,0.125,0.0,0.06147540983606557,0.8321067690849304
190,"If you if you want to take the shoes off, you can take the shoes off.",Just be sure.,"I, I, I, I, I, I, I, I, I, I, I, I, I, I, I, I, I, I, I, I, I, I, I, I, I, I, I, I, I, I, I, I, I, I, I, I, I, I, I, I, I, I, I, I, I, I, I, I, I, I, I, I, I, I, I, I, I, I, I, I, I, I, I, I,",You're not supposed to be driving.,0.0,0.0,0.0,0.7204201817512512,0.2,0.0,0.22727272727272727,0.8593809604644775
192,"All right. So, you still understand all the instructions to it?","Yes, sir.",YouYouYouYouYouYouYouYouYouYouYouYouYouYouYouYouYouYouYouYouYouYouYouYouYouYouYouYouYouYouYouYouYouYouYouYouYouYouYouYouYouYouYouYouYouYouYouYouYouYouYouYouYouYouYouYouYouYouYouYouYouYouYouYouYouYouYouYouYouYouYouYouYouYouYouYouYouYouYouYouYouYouYouYouYouYouYouYouYouYouYouYouYouYouYouYouYouYouYouYouYouYouYouYouYouYouYouYouYouYouYouYouYouYouYouYouYouYouYouYouYouYouYouYouYouYouYouYou,I.,0.0,0.0,0.0,0.7078547477722168,0.0,0.0,0.13157894736842105,0.8815630674362183
195,"If you have no questions, you can go ahead and begin.","Um, one, two, three, four, five, six, seven, eight, nine.","I, no, I'm sorry.",YouYouYouYouYouYouYouYouYouYouYouYouYouYouYouYouYouYouYouYouYouYouYouYouYouYouYouYouYouYouYouYouYouYouYouYouYouYouYouYouYouYouYouYouYouYouYouYouYouYouYouYouYouYouYouYouYouYouYouYouYouYouYouYouYouYouYouYouYouYouYouYouYouYouYouYouYouYouYouYouYouYouYouYouYouYouYouYouYouYouYouYouYouYouYouYouYouYouYouYouYouYouYouYouYouYouYouYouYouYouYouYouYouYouYouYouYouYouYouYouYouYouYouYouYouYouYouYou,0.0,0.0,0.10638297872340426,0.7864978909492493,0.0,0.0,0.0,0.6902735233306885
198,How did how did I explain you the exercise?,Okay.,YouYouYouYouYouYouYouYouYouYouYouYouYouYouYouYouYouYouYouYouYouYouYouYouYouYouYouYouYouYouYouYouYouYouYouYouYouYouYouYouYouYouYouYouYouYouYouYouYouYouYouYouYouYouYouYouYouYouYouYouYouYouYouYouYouYouYouYouYouYouYouYouYouYouYouYouYouYouYouYouYouYouYouYouYouYouYouYouYouYouYouYouYouYouYouYouYouYouYouYouYouYouYouYouYouYouYouYouYouYouYouYouYouYouYouYouYouYouYouYouYouYouYouYouYouYouYouYou,YouYouYouYouYouYouYouYouYouYouYouYouYouYouYouYouYouYouYouYouYouYouYouYouYouYouYouYouYouYouYouYouYouYouYouYouYouYouYouYouYouYouYouYouYouYouYouYouYouYouYouYouYouYouYouYouYouYouYouYouYouYouYouYouYouYouYouYouYouYouYouYouYouYouYouYouYouYouYouYouYouYouYouYouYouYouYouYouYouYouYouYouYouYouYouYouYouYouYouYouYouYouYouYouYouYouYouYouYouYouYouYouYouYouYouYouYouYouYouYouYouYouYouYouYouYouYouYou,0.0,0.0,0.0,0.7468857169151306,0.0,0.0,0.0,0.7468855977058411
201,Yeah.,"All right. One, two, three, four, five, six, seven, eight.","I, I, I, I, I, I, I, I, I, I, I, I, I, I, I, I, I, I, I, I, I, I, I, I, I, I, I, I, I, I, I, I, I, I, I, I, I, I, I, I, I, I, I, I, I, I, I, I, I, I, I, I, I, I, I, I, I, I, I, I, I, I, I, I,",I.,0.0,0.0,0.13377926421404684,0.7717509865760803,0.0,0.0,0.05780346820809248,0.8325974345207214
205,"All right, actually, let's come right here. It's a little more level because it's a pretty good slope.","Sorry, yeah.","I, I, I, I, I, I, I, I, I, I, I, I, I, I, I, I, I, I, I, I, I, I, I, I, I, I, I, I, I, I, I, I, I, I, I, I, I, I, I, I, I, I, I, I, I, I, I, I, I, I, I, I, I, I, I, I, I, I, I, I, I, I, I, I,","You're saying you're sorry, right?",0.0,0.0,0.030487804878048783,0.7364492416381836,0.22222222222222224,0.0,0.4166666666666667,0.8381370902061462
207,"Okay. Do you have any knee, ankle, hip problems, anything like that?","Um, no, not at all.",IIEIOO,I.,0.0,0.0,0.0,0.769403338432312,0.0,0.0,0.06756756756756756,0.8609830141067505
209,Okay. I just I yeah.,"Okay. So, this is so stupid.","I, I, I, I, I, I, I, I, I, I, I, I, I, I, I, I, I, I, I, I, I, I, I, I, I, I, I, I, I, I, I, I, I, I, I, I, I, I, I, I, I, I, I, I, I, I, I, I, I, I, I, I, I, I, I, I, I, I, I, I, I, I, I, I,",OkayOkayOkayOkayOkayOkayOkayOkayOkayOkayOkayOkayOkayOkayOkayOkayOkayOkayOkayOkayOkayOkayOkayOkayOkayOkayOkayOkayOkayOkayOkayOkayOkayOkayOkayOkayOkayOkayOkayOkayOkayOkayOkayOkayOkayOkayOkayOkayOkayOkayOkayOkayOkayOkayOkayOkayOkayOkayOkayOkayOkayOkayOkayOkayOkayOkayOkayOkayOkayOkayOkayOkayOkayOkayOkayOkayOkayOkayOkayOkayOkayOkayOkayOkayOkayOkayOkayOkayOkayOkayOkayOkayOkayOkayOkayOkayOkayOkayOkayOkayOkayOkayOkayOkayOkayOkayOkayOkayOkayOkayOkayOkayOkayOkayOkayOkayOkayOkayOkayOkayOkayOkayOkayOkayOkayOkayOkayOkay,0.0,0.0,0.023923444976076555,0.7553294897079468,0.0,0.0,0.0,0.7344328165054321
211,"I got you. Like we did on the first one, stand with your feet and heels together.",Yeah.,YouYouYouYouYouYouYouYouYouYouYouYouYouYouYouYouYouYouYouYouYouYouYouYouYouYouYouYouYouYouYouYouYouYouYouYouYouYouYouYouYouYouYouYouYouYouYouYouYouYouYouYouYouYouYouYouYouYouYouYouYouYouYouYouYouYouYouYouYouYouYouYouYouYouYouYouYouYouYouYouYouYouYouYouYouYouYouYouYouYouYouYouYouYouYouYouYouYouYouYouYouYouYouYouYouYouYouYouYouYouYouYouYouYouYouYouYouYouYouYouYouYouYouYouYouYouYouYou,OkayOkayOkayOkayOkayOkayOkayOkayOkayOkayOkayOkayOkayOkayOkayOkayOkayOkayOkayOkayOkayOkayOkayOkayOkayOkayOkayOkayOkayOkayOkayOkayOkayOkayOkayOkayOkayOkayOkayOkayOkayOkayOkayOkayOkayOkayOkayOkayOkayOkayOkayOkayOkayOkayOkayOkayOkayOkayOkayOkayOkayOkayOkayOkayOkayOkayOkayOkayOkayOkayOkayOkayOkayOkayOkayOkayOkayOkayOkayOkayOkayOkayOkayOkayOkayOkayOkayOkayOkayOkayOkayOkayOkayOkayOkayOkayOkayOkayOkayOkayOkayOkayOkayOkayOkayOkayOkayOkayOkayOkayOkayOkayOkayOkayOkayOkayOkayOkayOkayOkayOkayOkayOkayOkayOkayOkayOkayOkay,0.0,0.0,0.0,0.7471423149108887,0.0,0.0,0.0,0.7631955742835999
213,Arms straight down your side.,Yep.,"I, I, I, I, I, I, I, I, I, I, I, I, I, I, I, I, I, I, I, I, I, I, I, I, I, I, I, I, I, I, I, I, I, I, I, I, I, I, I, I, I, I, I, I, I, I, I, I, I, I, I, I, I, I, I, I, I, I, I, I, I, I, I, I,",Where are you going to be? Where are you going to be?,0.0,0.0,0.0,0.752679705619812,0.0,0.0,0.0,0.8606480956077576
216,"You're going to pick that foot up approximately six inches off the ground. It's about the height of a Coke can for reference, okay?",Yeah.,YouYouYouYouYouYouYouYouYouYouYouYouYouYouYouYouYouYouYouYouYouYouYouYouYouYouYouYouYouYouYouYouYouYouYouYouYouYouYouYouYouYouYouYouYouYouYouYouYouYouYouYouYouYouYouYouYouYouYouYouYouYouYouYouYouYouYouYouYouYouYouYouYouYouYouYouYouYouYouYouYouYouYouYouYouYouYouYouYouYouYouYouYouYouYouYouYouYouYouYouYouYouYouYouYouYouYouYouYouYouYouYouYouYouYouYouYouYouYouYouYouYouYouYouYouYouYouYou,OkayOkayOkayOkayOkayOkayOkayOkayOkayOkayOkayOkayOkayOkayOkayOkayOkayOkayOkayOkayOkayOkayOkayOkayOkayOkayOkayOkayOkayOkayOkayOkayOkayOkayOkayOkayOkayOkayOkayOkayOkayOkayOkayOkayOkayOkayOkayOkayOkayOkayOkayOkayOkayOkayOkayOkayOkayOkayOkayOkayOkayOkayOkayOkayOkayOkayOkayOkayOkayOkayOkayOkayOkayOkayOkayOkayOkayOkayOkayOkayOkayOkayOkayOkayOkayOkayOkayOkayOkayOkayOkayOkayOkayOkayOkayOkayOkayOkayOkayOkayOkayOkayOkayOkayOkayOkayOkayOkayOkayOkayOkayOkayOkayOkayOkayOkayOkayOkayOkayOkayOkayOkayOkayOkayOkayOkayOkayOkay,0.0,0.0,0.0,0.7471423149108887,0.0,0.0,0.0,0.7631955742835999
218,"And you're going to keep your toe pointed forward so the bottom of your foot will be parallel to the ground, okay?",Yeah.,YouYouYouYouYouYouYouYouYouYouYouYouYouYouYouYouYouYouYouYouYouYouYouYouYouYouYouYouYouYouYouYouYouYouYouYouYouYouYouYouYouYouYouYouYouYouYouYouYouYouYouYouYouYouYouYouYouYouYouYouYouYouYouYouYouYouYouYouYouYouYouYouYouYouYouYouYouYouYouYouYouYouYouYouYouYouYouYouYouYouYouYouYouYouYouYouYouYouYouYouYouYouYouYouYouYouYouYouYouYouYouYouYouYouYouYouYouYouYouYouYouYouYouYouYouYouYouYou,WhereWhereWhereWhereWhereWhereWhereWhereWhereWhereWhereWhereWhereWhereWhereWhereWhereWhereWhereWhereWhereWhereWhereWhereWhereWhereWhereWhereWhereWhereWhereWhereWhereWhereWhereWhereWhereWhereWhereWhereWhereWhereWhereWhereWhereWhereWhereWhereWhereWhereWhereWhereWhereWhereWhereWhereWhereWhereWhereWhereWhereWhereWhereWhereWhereWhereWhereWhereWhereWhereWhereWhereWhereWhereWhereWhereWhereWhereWhereWhereWhereWhereWhereWhereWhereWhereWhereWhereWhereWhereWhereWhereWhereWhereWhereWhereWhereWhereWhereWhereWhereWhereWhereWhereWhereWhereWhereWhereWhereWhereWhereWhereWhereWhereWhereWhereWhereWhereWhereWhereWhereWhereWhereWhereWhereWhereWhereWhere,0.0,0.0,0.0,0.7471423149108887,0.0,0.0,0.0,0.7226846814155579
220,You're going to look at like that or,Like that or,"I, I, I, I, I, I, I, I, I, I, I, I, I, I, I, I, I, I, I, I, I, I, I, I, I, I, I, I, I, I, I, I, I, I, I, I, I, I, I, I, I, I, I, I, I, I, I, I, I, I, I, I, I, I, I, I, I, I, I, I, I, I, I, I,",OkayOkayOkayOkayOkayOkayOkayOkayOkayOkayOkayOkayOkayOkayOkayOkayOkayOkayOkayOkayOkayOkayOkayOkayOkayOkayOkayOkayOkayOkayOkayOkayOkayOkayOkayOkayOkayOkayOkayOkayOkayOkayOkayOkayOkayOkayOkayOkayOkayOkayOkayOkayOkayOkayOkayOkayOkayOkayOkayOkayOkayOkayOkayOkayOkayOkayOkayOkayOkayOkayOkayOkayOkayOkayOkayOkayOkayOkayOkayOkayOkayOkayOkayOkayOkayOkayOkayOkayOkayOkayOkayOkayOkayOkayOkayOkayOkayOkayOkayOkayOkayOkayOkayOkayOkayOkayOkayOkayOkayOkayOkayOkayOkayOkayOkayOkayOkayOkayOkayOkayOkayOkayOkayOkayOkayOkayOkayOkay,0.0,0.0,0.0,0.7225443720817566,0.0,0.0,0.0,0.6958538889884949
222,Like this.,Okay.,YouYouYouYouYouYouYouYouYouYouYouYouYouYouYouYouYouYouYouYouYouYouYouYouYouYouYouYouYouYouYouYouYouYouYouYouYouYouYouYouYouYouYouYouYouYouYouYouYouYouYouYouYouYouYouYouYouYouYouYouYouYouYouYouYouYouYouYouYouYouYouYouYouYouYouYouYouYouYouYouYouYouYouYouYouYouYouYouYouYouYouYouYouYouYouYouYouYouYouYouYouYouYouYouYouYouYouYouYouYouYouYouYouYouYouYouYouYouYouYouYouYouYouYouYouYouYouYou,Thank you. Thank you. Thank you. Thank you. Thank you. Thank you. Thank you. Thank you. Thank you. Thank you. Thank you. Thank you. Thank you. Thank you. Thank you. Thank you. Thank you. Thank you. Thank you. Thank you. Thank you. Thank you. Thank you. Thank you. Thank you. Thank you. Thank you. Thank you. Thank you. Thank you. Thank you. Thank you. Thank you. Thank you. Thank you. Thank you. Thank you. Thank you. Thank you. Thank you. Thank you. Thank you. Thank you,0.0,0.0,0.0,0.7468857169151306,0.0,0.0,0.03424657534246576,0.8352184891700745
225,Makes sense so far?,1000 from 1000?,I,YouYouYouYouYouYouYouYouYouYouYouYouYouYouYouYouYouYouYouYouYouYouYouYouYouYouYouYouYouYouYouYouYouYouYouYouYouYouYouYouYouYouYouYouYouYouYouYouYouYouYouYouYouYouYouYouYouYouYouYouYouYouYouYouYouYouYouYouYouYouYouYouYouYouYouYouYouYouYouYouYouYouYouYouYouYouYouYouYouYouYouYouYouYouYouYouYouYouYouYouYouYouYouYouYouYouYouYouYouYouYouYouYouYouYouYouYouYouYouYouYouYouYouYouYouYouYouYou,0.0,0.0,0.0,0.8208630681037903,0.0,0.0,0.0,0.6935040354728699
227,"Yeah, you're 1001, 1002, 1003 until I tell you to stop, okay?",Yep.,YouYouYouYouYouYouYouYouYouYouYouYouYouYouYouYouYouYouYouYouYouYouYouYouYouYouYouYouYouYouYouYouYouYouYouYouYouYouYouYouYouYouYouYouYouYouYouYouYouYouYouYouYouYouYouYouYouYouYouYouYouYouYouYouYouYouYouYouYouYouYouYouYouYouYouYouYouYouYouYouYouYouYouYouYouYouYouYouYouYouYouYouYouYouYouYouYouYouYouYouYouYouYouYouYouYouYouYouYouYouYouYouYouYouYouYouYouYouYouYouYouYouYouYouYouYouYouYou,I.,0.0,0.0,0.0,0.7486892342567444,0.0,0.0,0.25,0.9919958114624023
230,Makes sense?,Yes.,YouYouYouYouYouYouYouYouYouYouYouYouYouYouYouYouYouYouYouYouYouYouYouYouYouYouYouYouYouYouYouYouYouYouYouYouYouYouYouYouYouYouYouYouYouYouYouYouYouYouYouYouYouYouYouYouYouYouYouYouYouYouYouYouYouYouYouYouYouYouYouYouYouYouYouYouYouYouYouYouYouYouYouYouYouYouYouYouYouYouYouYouYouYouYouYouYouYouYouYouYouYouYouYouYouYouYouYouYouYouYouYouYouYouYouYouYouYouYouYouYouYouYouYouYouYouYouYou,You're not supposed to be driving.,0.0,0.0,0.0,0.7480742931365967,0.0,0.0,0.19230769230769235,0.8805669546127319
232,"Okay. The whole time you're performing the exercise, remember to look at your feet or look at your foot. Count out loud in thousands. Leave your arms at your side. Make sure you leave both legs straight with your foot approximately six inches off the ground with your toe pointed forward.",Got it.,ItItItItItItItItItItItItItItItItItItItItItItItItItItItItItItItItItItItItItItItItItItItItItItItItItItItItItItItItItItItItItItItItItItItItItItItItItItItItItItItItItItItItItItItItItItItItItItItItItItItItItItItItItItItItItItItItItItItItItItItItItItItItItItItIt,I.,0.0,0.0,0.0,0.7508015036582947,0.0,0.0,0.17241379310344826,0.9266489744186401
234,Makes sense?,Yep.,"I, J, K, L, M, N, O, P, X, C, sorry. I'm from Switzerland. I'm a little different.",I.,0.0,0.0,0.09803921568627451,0.8399749398231506,0.0,0.0,0.25,0.9919958114624023
236,Okay. Do you have any questions?,"No, sir.","I, I, J, K, L, M, N, O, P, X, C, sorry. I'm from Switzerland. I'm a little different.",YouYouYouYouYouYouYouYouYouYouYouYouYouYouYouYouYouYouYouYouYouYouYouYouYouYouYouYouYouYouYouYouYouYouYouYouYouYouYouYouYouYouYouYouYouYouYouYouYouYouYouYouYouYouYouYouYouYouYouYouYouYouYouYouYouYouYouYouYouYouYouYouYouYouYouYouYouYouYouYouYouYouYouYouYouYouYouYouYouYouYouYouYouYouYouYouYouYouYouYouYouYouYouYouYouYouYouYouYouYouYouYouYouYouYouYouYouYouYouYouYouYouYouYouYouYouYouYou,0.0,0.0,0.14084507042253522,0.8020962476730347,0.0,0.0,0.0,0.7081362009048462
239,"All right, if you have no questions, you can go ahead and begin.","1001, 1002, 1003, 1004, 1005, 1006, 1007, 1007, 1008, 1009, 1010, 1011, 1012, 1013, 1014, 1014, 1015, 1016, 1017, 1018, 1019, 1020, 1021, 1022, 1023, 1024, 1025, 1026, 1027, 1028, 1029.",I,I.,0.0,0.0,0.0,0.7457302212715149,0.0,0.0,0.008928571428571428,0.788669764995575
241,"Okay, you can stop.",Okay.,ItItItItItItItItItItItItItItItItItItItItItItItItItItItItItItItItItItItItItItItItItItItItItItItItItItItItItItItItItItItItItItItItItItItItItItItItItItItItItItItItItItItItItItItItItItItItItItItItItItItItItItItItItItItItItItItItItItItItItItItItItItItItItItItIt,You're you're you're you're you're you're you're you're you're you're you're you're you're you're you're you're you're you're you're you're you're you're you're you're you're you're you're you're you're you're you're you're you're you're you're you're you're you're you're you're you're you're you're you're you're you're you're you're you're you're you're you're you're you're you're you're you're you're you're you're you're you're you're you're,0.0,0.0,0.0,0.7564109563827515,0.0,0.0,0.0,0.7253898978233337
246,What's your highest level of education?,"Uh, I did bachelor's degree in economics.",IİI,I.,0.2,0.0,0.0,0.7599037289619446,0.2222222222222222,0.0,0.10869565217391304,0.8846684694290161
248,"Okay. So, is it safe to assume you're familiar with the English alphabet from the letter A to Z?",Yeah.,"I, I, I, I, I, I, I, I, I, I, I, I, I, I, I, I, I, I, I, I, I, I, I, I, I, I, I, I, I, I, I, I, I, I, I, I, I, I, I, I, I, I, I, I, I, I, I, I, I, I, I, I, I, I, I, I, I, I, I, I, I, I, I, I,",YouYouYouYouYouYouYouYouYouYouYouYouYouYouYouYouYouYouYouYouYouYouYouYouYouYouYouYouYouYouYouYouYouYouYouYouYouYouYouYouYouYouYouYouYouYouYouYouYouYouYouYouYouYouYouYouYouYouYouYouYouYouYouYouYouYouYouYouYouYouYouYouYouYouYouYouYouYouYouYouYouYouYouYouYouYouYouYouYouYouYouYouYouYouYouYouYouYouYouYouYouYouYouYouYouYouYouYouYouYouYouYouYouYouYouYouYouYouYouYouYouYouYouYouYouYouYouYou,0.0,0.0,0.0,0.7525272369384766,0.0,0.0,0.0,0.7471423149108887
250,"Okay. Do you think when I when I tell you to, do you think you could recite the English alphabet from the letter A to Z in a non-rhythmic tone? So, not singing the alphabet song, just saying A, B, C.",Yeah.,YouYouYouYouYouYouYouYouYouYouYouYouYouYouYouYouYouYouYouYouYouYouYouYouYouYouYouYouYouYouYouYouYouYouYouYouYouYouYouYouYouYouYouYouYouYouYouYouYouYouYouYouYouYouYouYouYouYouYouYouYouYouYouYouYouYouYouYouYouYouYouYouYouYouYouYouYouYouYouYouYouYouYouYouYouYouYouYouYouYouYouYouYouYouYouYouYouYouYouYouYouYouYouYouYouYouYouYouYouYouYouYouYouYouYouYouYouYouYouYouYouYouYouYouYouYouYouYou,Thank you.,0.0,0.0,0.0,0.7471423149108887,0.0,0.0,0.2380952380952381,0.9217853546142578
252,Can you do that?,"Yes, sir.",I,I.,0.0,0.0,0.0,0.8405606746673584,0.0,0.0,0.13157894736842105,0.8815630674362183
254,"Okay. So, with your feet and heels together, arms down your side, I want you to tilt your head slightly back, close your eyes and recite the alphabet from the letter A to Z.","A, B, C, D, E, F, G, H, I, J, K, L, M, N, O, P, Q, R, S, T, U, V, um, D, X, C, sorry. I'm from Switzerland. I'm a little different. I'm sorry.","I, I, I, I, I, I, I, I, I, I, I, I, I, I, I, I, I, I, I, I, I, I, I, I, I, I, I, I, I, I, I, I, I, I, I, I, I, I, I, I, I, I, I, I, I, I, I, I, I, I, I, I, I, I, I, I, I, I, I, I, I, I, I, I,",You you you you you you you you you you you you you you you you you you you you you you you you you you you you you you you you you you you you you you you you you you you you you you you you you you you you you you you you you you you you you you you you you you you you you you you you you you you you you you you you you you you you you you you you you you you you you you you you you you you you you you you you you you you you you you you you you you you you you you you you you you you you you you you you,0.07766990291262135,0.0,0.20026702269692925,0.8031251430511475,0.0,0.0,0.0,0.7091825008392334
256,How long have you been in America?,"Uh, for three years now.",YouYouYouYouYouYouYouYouYouYouYouYouYouYouYouYouYouYouYouYouYouYouYouYouYouYouYouYouYouYouYouYouYouYouYouYouYouYouYouYouYouYouYouYouYouYouYouYouYouYouYouYouYouYouYouYouYouYouYouYouYouYouYouYouYouYouYouYouYouYouYouYouYouYouYouYouYouYouYouYouYouYouYouYouYouYouYouYouYouYouYouYouYouYouYouYouYouYouYouYouYouYouYouYouYouYouYouYouYouYouYouYouYouYouYouYouYouYouYouYouYouYouYouYouYouYouYouYou,YouYouYouYouYouYouYouYouYouYouYouYouYouYouYouYouYouYouYouYouYouYouYouYouYouYouYouYouYouYouYouYouYouYouYouYouYouYouYouYouYouYouYouYouYouYouYouYouYouYouYouYouYouYouYouYouYouYouYouYouYouYouYouYouYouYouYouYouYouYouYouYouYouYouYouYouYouYouYouYouYouYouYouYouYouYouYouYouYouYouYouYouYouYouYouYouYouYouYouYouYouYouYouYouYouYouYouYouYouYouYouYouYouYouYouYouYouYouYouYouYouYouYouYouYouYouYouYou,0.0,0.0,0.0,0.7038631439208984,0.0,0.0,0.0,0.7038631439208984
258,Okay. Do you come over like initially on a student visa and then stayed kind of?,"Uh, I have a green card.",I,YouYouYouYouYouYouYouYouYouYouYouYouYouYouYouYouYouYouYouYouYouYouYouYouYouYouYouYouYouYouYouYouYouYouYouYouYouYouYouYouYouYouYouYouYouYouYouYouYouYouYouYouYouYouYouYouYouYouYouYouYouYouYouYouYouYouYouYouYouYouYouYouYouYouYouYouYouYouYouYouYouYouYouYouYouYouYouYouYouYouYouYouYouYouYouYouYouYouYouYouYouYouYouYouYouYouYouYouYouYouYouYouYouYouYouYouYouYouYouYouYouYouYouYouYouYouYouYou,0.2857142857142857,0.0,0.0684931506849315,0.8400648236274719,0.0,0.0,0.0,0.7115486860275269
260,"Okay. I got you. Um, so, staying with your feet and heels together.",Yep.,YouYouYouYouYouYouYouYouYouYouYouYouYouYouYouYouYouYouYouYouYouYouYouYouYouYouYouYouYouYouYouYouYouYouYouYouYouYouYouYouYouYouYouYouYouYouYouYouYouYouYouYouYouYouYouYouYouYouYouYouYouYouYouYouYouYouYouYouYouYouYouYouYouYouYouYouYouYouYouYouYouYouYouYouYouYouYouYouYouYouYouYouYouYouYouYouYouYouYouYouYouYouYouYouYouYouYouYouYouYouYouYouYouYouYouYouYouYouYouYouYouYouYouYouYouYouYouYou,I.,0.0,0.0,0.0,0.7486892342567444,0.0,0.0,0.25,0.9919958114624023
263,"All right, can we agree that this is the tip of your finger?",Yep.,I,You have a ticket.,0.0,0.0,0.0,0.956893801689148,0.0,0.0,0.21739130434782608,0.9147934317588806
