Turn_Index,Officer_Input,Real_Suspect_Response,Base_Model_Response,Fine_Tuned_Response,Base_ROUGE-L,Base_BLEU-4,Base_METEOR,Base_BERTScore_F1,FT_ROUGE-L,FT_BLEU-4,FT_METEOR,FT_BERTScore_F1
398,"There, you know, there's a process to this. But tonight you are going to go to jail, okay? There is no way that we can get around that.",Why not? I promise I'll have somebody pick me up.,I,CanCanCanCanCanCanCanCanCanCanCanCanCanCanCanCanCanCanCanCanCanCanCanCanCanCanCanCanCanCanCanCanCanCanCanCanCanCanCanCanCanCanCanCanCanCanCanCanCanCanCanCanCanCanCanCanCanCanCanCanCanCanCanCanCanCanCanCanCanCanCanCanCanCanCanCanCanCanCanCanCanCanCanCanCanCanCanCanCanCanCanCanCanCanCanCanCanCanCanCanCanCanCanCanCanCanCanCanCanCanCanCanCanCanCanCanCanCanCanCanCanCanCanCanCanCanCanCan,0.16666666666666669,0.0,0.04237288135593221,0.8048818111419678,0.0,0.0,0.0,0.6972312331199646
401,"a bracelet. So, you were at a bar or a club tonight. What's the yellow bracelet?",That was from Friday. That was already lost. That was a couple nights ago.,YouYouYouYouYouYouYouYouYouYouYouYouYouYouYouYouYouYouYouYouYouYouYouYouYouYouYouYouYouYouYouYouYouYouYouYouYouYouYouYouYouYouYouYouYouYouYouYouYouYouYouYouYouYouYouYouYouYouYouYouYouYouYouYouYouYouYouYouYouYouYouYouYouYouYouYouYouYouYouYouYouYouYouYouYouYouYouYouYouYouYouYouYouYouYouYouYouYouYouYouYouYouYouYouYouYouYouYouYouYouYouYouYouYouYouYouYouYouYouYouYouYouYouYouYouYouYouYou,YouYouYouYouYouYouYouYouYouYouYouYouYouYouYouYouYouYouYouYouYouYouYouYouYouYouYouYouYouYouYouYouYouYouYouYouYouYouYouYouYouYouYouYouYouYouYouYouYouYouYouYouYouYouYouYouYouYouYouYouYouYouYouYouYouYouYouYouYouYouYouYouYouYouYouYouYouYouYouYouYouYouYouYouYouYouYouYouYouYouYouYouYouYouYouYouYouYouYouYouYouYouYouYouYouYouYouYouYouYouYouYouYouYouYouYouYouYouYouYouYouYouYouYouYouYouYouYou,0.0,0.0,0.0,0.7089065909385681,0.0,0.0,0.0,0.7089065909385681
403,"So, you were just at a Halloween party tonight.",I believe you. I promise that bracelet was from two nights ago.,I,OkayOkayOkayOkayOkayOkayOkayOkayOkayOkayOkayOkayOkayOkayOkayOkayOkayOkayOkayOkayOkayOkayOkayOkayOkayOkayOkayOkayOkayOkayOkayOkayOkayOkayOkayOkayOkayOkayOkayOkayOkayOkayOkayOkayOkayOkayOkayOkayOkayOkayOkayOkayOkayOkayOkayOkayOkayOkayOkayOkayOkayOkayOkayOkayOkayOkayOkayOkayOkayOkayOkayOkayOkayOkayOkayOkayOkayOkayOkayOkayOkayOkayOkayOkayOkayOkayOkayOkayOkayOkayOkayOkayOkayOkayOkayOkayOkayOkayOkayOkayOkayOkayOkayOkayOkayOkayOkayOkayOkayOkayOkayOkayOkayOkayOkayOkayOkayOkayOkayOkayOkayOkayOkayOkayOkayOkayOkayOkay,0.15384615384615385,0.0,0.03937007874015748,0.8189262747764587,0.0,0.0,0.0,0.7138809561729431
406,It's very clear you were at a Halloween party tonight.,Yes.,I,I.,0.0,0.0,0.0,0.9455347657203674,0.0,0.0,0.25,0.9842480421066284
409,"That's why we covered you because you are going to go to jail, okay?",Is there nothing we can do about like at least like have somebody pick me up or something?,YouYouYouYouYouYouYouYouYouYouYouYouYouYouYouYouYouYouYouYouYouYouYouYouYouYouYouYouYouYouYouYouYouYouYouYouYouYouYouYouYouYouYouYouYouYouYouYouYouYouYouYouYouYouYouYouYouYouYouYouYouYouYouYouYouYouYouYouYouYouYouYouYouYouYouYouYouYouYouYouYouYouYouYouYouYouYouYouYouYouYouYouYouYouYouYouYouYouYouYouYouYouYouYouYouYouYouYouYouYouYouYouYouYouYouYouYouYouYouYouYouYouYouYouYouYouYouYou,Where where where where where where where where where where where where where where where where where where where where where where where where where where where where where where where where where where where where where where where where where where where where where where where where where where where where where where where where where where where where where where where where where where where where where where where where where where where where where where where where where where where where where where where where where where where where where where where where where where where where where where where where where where where where where where where where where where where where where where where where where where where where where where where where,0.0,0.0,0.0,0.6862878799438477,0.0,0.0,0.0,0.6833029389381409
411,Nope. Nope.,I can't not but I'm from Switzerland. I cannot be.,YouYouYouYouYouYouYouYouYouYouYouYouYouYouYouYouYouYouYouYouYouYouYouYouYouYouYouYouYouYouYouYouYouYouYouYouYouYouYouYouYouYouYouYouYouYouYouYouYouYouYouYouYouYouYouYouYouYouYouYouYouYouYouYouYouYouYouYouYouYouYouYouYouYouYouYouYouYouYouYouYouYouYouYouYouYouYouYouYouYouYouYouYouYouYouYouYouYouYouYouYouYouYouYouYouYouYouYouYouYouYouYouYouYouYouYouYouYouYouYouYouYouYouYouYouYouYouYou,ThankThankThankThankThankThankThankThankThankThankThankThankThankThankThankThankThankThankThankThankThankThankThankThankThankThankThankThankThankThankThankThankThankThankThankThankThankThankThankThankThankThankThankThankThankThankThankThankThankThankThankThankThankThankThankThankThankThankThankThankThankThankThankThankThankThankThankThankThankThankThankThankThankThankThankThankThankThankThankThankThankThankThankThankThankThankThankThankThankThankThankThankThankThankThankThankThankThankThankThankThankThankThankThankThankThankThankThankThankThankThankThankThankThankThankThankThankThankThankThankThankThankThankThankThankThankThankThank,0.0,0.0,0.0,0.7082781195640564,0.0,0.0,0.0,0.6960901021957397
413,"Okay. And I'm from New Hampshire and if I were driving drunk tonight, I would go to jail too.","I know, but if I have a DUI, I cannot live here anymore.",YouYouYouYouYouYouYouYouYouYouYouYouYouYouYouYouYouYouYouYouYouYouYouYouYouYouYouYouYouYouYouYouYouYouYouYouYouYouYouYouYouYouYouYouYouYouYouYouYouYouYouYouYouYouYouYouYouYouYouYouYouYouYouYouYouYouYouYouYouYouYouYouYouYouYouYouYouYouYouYouYouYouYouYouYouYouYouYouYouYouYouYouYouYouYouYouYouYouYouYouYouYouYouYouYouYouYouYouYouYouYouYouYouYouYouYouYouYouYouYouYouYouYouYouYouYouYouYou,I,0.0,0.0,0.0,0.7143862843513489,0.14285714285714288,0.0,0.032467532467532464,0.8186938762664795
416,"Sure, sure.","Yes, sir, but I can we not just please make an exception or something?",IIEOIOOHOHOHOHOHOHOHOHOHOHOHOHOHOHOHOHOHOHOHOHOHOHOHOHOHOHOHOHOHOHOHOHOHOHOHOHOHOHOHOHOHOHOHOHOHOHOHOHOHOHOHOHOHOHOHOHOHOHOHOHOHOHOHOHOHOHOHOHOHOHOHOHOHOHOHOHOHOHOHOHOHOHOHOHOHOHOHOHOHOHOHOHOHOHOHOHOHOHOHOHOHOHOHOHOHOHOHOHOHOHOHOHOHOHOHOHOHOHOHOHOHOHOHO,YouYouYouYouYouYouYouYouYouYouYouYouYouYouYouYouYouYouYouYouYouYouYouYouYouYouYouYouYouYouYouYouYouYouYouYouYouYouYouYouYouYouYouYouYouYouYouYouYouYouYouYouYouYouYouYouYouYouYouYouYouYouYouYouYouYouYouYouYouYouYouYouYouYouYouYouYouYouYouYouYouYouYouYouYouYouYouYouYouYouYouYouYouYouYouYouYouYouYouYouYouYouYouYouYouYouYouYouYouYouYouYouYouYouYouYouYouYouYouYouYouYouYouYouYouYouYouYou,0.0,0.0,0.0,0.6818376779556274,0.0,0.0,0.0,0.6914811730384827
419,"So, I'm going to ask you one more time, please walk over to my car and then we'll",What happens with tonight?,YouYouYouYouYouYouYouYouYouYouYouYouYouYouYouYouYouYouYouYouYouYouYouYouYouYouYouYouYouYouYouYouYouYouYouYouYouYouYouYouYouYouYouYouYouYouYouYouYouYouYouYouYouYouYouYouYouYouYouYouYouYouYouYouYouYouYouYouYouYouYouYouYouYouYouYouYouYouYouYouYouYouYouYouYouYouYouYouYouYouYouYouYouYouYouYouYouYouYouYouYouYouYouYouYouYouYouYouYouYouYouYouYouYouYouYouYouYouYouYouYouYouYouYouYouYouYouYou,IICCCCCCCCCCCCCCCCCCCCCCCCCCCCCCCCCCCCCCCCCCCCCCCCCCCCCCCCCCCCCCCCCCCCCCCCCCCCCCCCCCCCCCCCCCCCCCCCCCCCCCCCCCCCCCCCCCCCCCCCCCCCCCCCCCCCCCCCCCCCCCCCCCCCCCCCCCCCCCCCCCCCCCCCCCCCCCCCCCCCCCCCCCCCCCCCCCCCCCCCCCCCCCCCCCCCCCCCCCCCCCCCCCCCCCCCCCCCCCCCCCCCCCCCCCCCCCCCCCCCCCCCCCCCCCCCCCCCCCCCCCCCCCCCCCCCCCCCCCCCCCCCCCCCCCCCCCCCCCCCCCCCCCCCCCCCCCCCCCCCCCCCCCCCCCCCCCCCCCCCCCCCCCCCCCCCCCCCCCCCCCCCCCCCCCCCCCCCCCCCCCCCCCCCCCCCCCCCCCCCCCCCCCCCCCCCCCCCCCCCCCCCCCCCCCCCCCCCCCCCCCCCCCCCCCCCCCCCCCCCCCCCCCCCCCCCCCCCCCCCCCCCC,0.0,0.0,0.0,0.7073371410369873,0.0,0.0,0.0,0.682579517364502
422,Do you have a a different pair of shoes?,No.,YouYouYouYouYouYouYouYouYouYouYouYouYouYouYouYouYouYouYouYouYouYouYouYouYouYouYouYouYouYouYouYouYouYouYouYouYouYouYouYouYouYouYouYouYouYouYouYouYouYouYouYouYouYouYouYouYouYouYouYouYouYouYouYouYouYouYouYouYouYouYouYouYouYouYouYouYouYouYouYouYouYouYouYouYouYouYouYouYouYouYouYouYouYouYouYouYouYouYouYouYouYouYouYouYouYouYouYouYouYouYouYouYouYouYouYouYouYouYouYouYouYouYouYouYouYouYouYou,YouYouYouYouYouYouYouYouYouYouYouYouYouYouYouYouYouYouYouYouYouYouYouYouYouYouYouYouYouYouYouYouYouYouYouYouYouYouYouYouYouYouYouYouYouYouYouYouYouYouYouYouYouYouYouYouYouYouYouYouYouYouYouYouYouYouYouYouYouYouYouYouYouYouYouYouYouYouYouYouYouYouYouYouYouYouYouYouYouYouYouYouYouYouYouYouYouYouYouYouYouYouYouYouYouYouYouYouYouYouYouYouYouYouYouYouYouYouYouYouYouYouYouYouYouYouYouYou,0.0,0.0,0.0,0.7494717240333557,0.0,0.0,0.0,0.7494717240333557
424,You don't have sandals or anything?,"No, okay.",YouYouYouYouYouYouYouYouYouYouYouYouYouYouYouYouYouYouYouYouYouYouYouYouYouYouYouYouYouYouYouYouYouYouYouYouYouYouYouYouYouYouYouYouYouYouYouYouYouYouYouYouYouYouYouYouYouYouYouYouYouYouYouYouYouYouYouYouYouYouYouYouYouYouYouYouYouYouYouYouYouYouYouYouYouYouYouYouYouYouYouYouYouYouYouYouYouYouYouYouYouYouYouYouYouYouYouYouYouYouYouYouYouYouYouYouYouYouYouYouYouYouYouYouYouYouYouYou,OkayOkayOkayOkayOkayOkayOkayOkayOkayOkayOkayOkayOkayOkayOkayOkayOkayOkayOkayOkayOkayOkayOkayOkayOkayOkayOkayOkayOkayOkayOkayOkayOkayOkayOkayOkayOkayOkayOkayOkayOkayOkayOkayOkayOkayOkayOkayOkayOkayOkayOkayOkayOkayOkayOkayOkayOkayOkayOkayOkayOkayOkayOkayOkayOkayOkayOkayOkayOkayOkayOkayOkayOkayOkayOkayOkayOkayOkayOkayOkayOkayOkayOkayOkayOkayOkayOkayOkayOkayOkayOkayOkayOkayOkayOkayOkayOkayOkayOkayOkayOkayOkayOkayOkayOkayOkayOkayOkayOkayOkayOkayOkayOkayOkayOkayOkayOkayOkayOkayOkayOkayOkayOkayOkayOkayOkayOkayOkay,0.0,0.0,0.0,0.7118396162986755,0.0,0.0,0.0,0.7333428859710693
429,"I'm going to we'll take your phone and here, this bag's small enough. There's nothing in this bag, right?",I have my phone over there.,IICIISCISSISCISSICIISCISSISSISSISSISSISSISSISSISSISSISSISSISSISSISSISSISSISSISSISSISSISSISSISSISSISSISSISSISSISSISSISSISSISSISSISSISSISSISSISSISSISSISSISSISSISSISSISSISSISSISSISSISSISSISSISSISSISSISSISSISSISSISSISSISSISSISSISSISSISSISSISSISSISSISSISSISSISSISSISSISSISSISSISSISSISSISSISSISSISSISSISSISSISSISSISSISSISSISSISSISSISSISSISSISSISSISSISSISSISSISSISSISSISSISSISSISS,ThankThankThankThankThankThankThankThankThankThankThankThankThankThankThankThankThankThankThankThankThankThankThankThankThankThankThankThankThankThankThankThankThankThankThankThankThankThankThankThankThankThankThankThankThankThankThankThankThankThankThankThankThankThankThankThankThankThankThankThankThankThankThankThankThankThankThankThankThankThankThankThankThankThankThankThankThankThankThankThankThankThankThankThankThankThankThankThankThankThankThankThankThankThankThankThankThankThankThankThankThankThankThankThankThankThankThankThankThankThankThankThankThankThankThankThankThankThankThankThankThankThankThankThankThankThankThankThank,0.0,0.0,0.0,0.7104647755622864,0.0,0.0,0.0,0.702302098274231
432,"That way you have it, okay?","Sorry, can you not make an exception, please? I promise I would never.",IICIIC,YouYouYouYouYouYouYouYouYouYouYouYouYouYouYouYouYouYouYouYouYouYouYouYouYouYouYouYouYouYouYouYouYouYouYouYouYouYouYouYouYouYouYouYouYouYouYouYouYouYouYouYouYouYouYouYouYouYouYouYouYouYouYouYouYouYouYouYouYouYouYouYouYouYouYouYouYouYouYouYouYouYouYouYouYouYouYouYouYouYouYouYouYouYouYouYouYouYouYouYouYouYouYouYouYouYouYouYouYouYouYouYouYouYouYouYouYouYouYouYouYouYouYouYouYouYouYouYou,0.0,0.0,0.0,0.773962676525116,0.0,0.0,0.0,0.7224547266960144
434,"I'm trying. So, let's.","I know. I understand about the drinking stuff, but",IIEIOO,IISUSUUSUUSUUSUUSUUSUUSUUSUUSUUSUUSUUSUUSUUSUUSUUSUUSUUSUUSUUSUUSUUSUUSUUSUUSUUSUUSUUSUUSUUSUUSUUSUUSUUSUUSUUSUUSUUSUUSUUSUUSUUSUUSUUSUUSUUSUUSUUSUUSUUSUUSUUSUUSUUSUUSUUSUUSUUSUUSUUSUUSUUSUUSU,0.0,0.0,0.0,0.7965647578239441,0.0,0.0,0.0,0.7222904562950134
437,"We're we're going to grab. I'm getting everything for you, okay?",Are you going to leave my car here?,YouYouYouYouYouYouYouYouYouYouYouYouYouYouYouYouYouYouYouYouYouYouYouYouYouYouYouYouYouYouYouYouYouYouYouYouYouYouYouYouYouYouYouYouYouYouYouYouYouYouYouYouYouYouYouYouYouYouYouYouYouYouYouYouYouYouYouYouYouYouYouYouYouYouYouYouYouYouYouYouYouYouYouYouYouYouYouYouYouYouYouYouYouYouYouYouYouYouYouYouYouYouYouYouYouYouYouYouYouYouYouYouYouYouYouYouYouYouYouYouYouYouYouYouYouYouYouYou,ThankYou. Thank you. Thank you. Thank you. Thank you. Thank you. Thank you. Thank you. Thank you. Thank you. Thank you. Thank you. Thank you. Thank you. Thank you. Thank you. Thank you. Thank you. Thank you. Thank you. Thank you. Thank you. Thank you. Thank you. Thank you. Thank you. Thank you. Thank you. Thank you. Thank you. Thank you. Thank you. Thank you. Thank you. Thank you. Thank you. Thank you. Thank you. Thank you. Thank you. Thank you. Thank you. Thank you,0.0,0.0,0.0,0.7121241688728333,0.02150537634408602,0.0,0.024038461538461543,0.7975630760192871
440,"I'll put your watch in here too, okay?",My money?,IIE,You're you're you're you're you're you're you're you're you're you're you're you're you're you're you're you're you're you're you're you're you're you're you're you're you're you're you're you're you're you're you're you're you're you're you're you're you're you're you're you're you're you're you're you're you're you're you're you're you're you're you're you're you're you're you're you're you're you're you're you're you're you're you're you're,0.0,0.0,0.0,0.8087227940559387,0.0,0.0,0.0,0.6851395964622498
445,"Okay, it's we're past we're past that. No one wants to go to jail.",I want to be home or daddy's here.,IIEFGHIJKLMNOPQRSTUVWXYZ,OkayOkayOkayOkayOkayOkayOkayOkayOkayOkayOkayOkayOkayOkayOkayOkayOkayOkayOkayOkayOkayOkayOkayOkayOkayOkayOkayOkayOkayOkayOkayOkayOkayOkayOkayOkayOkayOkayOkayOkayOkayOkayOkayOkayOkayOkayOkayOkayOkayOkayOkayOkayOkayOkayOkayOkayOkayOkayOkayOkayOkayOkayOkayOkayOkayOkayOkayOkayOkayOkayOkayOkayOkayOkayOkayOkayOkayOkayOkayOkayOkayOkayOkayOkayOkayOkayOkayOkayOkayOkayOkayOkayOkayOkayOkayOkayOkayOkayOkayOkayOkayOkayOkayOkayOkayOkayOkayOkayOkayOkayOkayOkayOkayOkayOkayOkayOkayOkayOkayOkayOkayOkayOkayOkayOkayOkayOkayOkay,0.0,0.0,0.0,0.7399594187736511,0.0,0.0,0.0,0.7144054770469666
447,"Come on. Come on, please.","They're all in Switzerland, sir.",IIEOANURGHJKLMDFİKŞİÖÜAZERTYUIOPĞĞĞĞĞĞĞĞĞĞĞĞĞĞĞĞĞĞĞĞĞĞĞĞĞĞĞĞĞĞĞĞĞĞĞĞĞĞĞĞĞĞĞĞĞĞĞĞĞĞĞĞĞĞĞĞĞĞĞĞĞĞĞĞĞĞĞĞĞĞĞĞĞĞĞĞĞĞĞĞĞĞĞĞĞĞĞĞĞĞĞĞĞĞĞĞĞĞĞĞĞĞĞĞĞĞĞĞĞ,OkayOkayOkayOkayOkayOkayOkayOkayOkayOkayOkayOkayOkayOkayOkayOkayOkayOkayOkayOkayOkayOkayOkayOkayOkayOkayOkayOkayOkayOkayOkayOkayOkayOkayOkayOkayOkayOkayOkayOkayOkayOkayOkayOkayOkayOkayOkayOkayOkayOkayOkayOkayOkayOkayOkayOkayOkayOkayOkayOkayOkayOkayOkayOkayOkayOkayOkayOkayOkayOkayOkayOkayOkayOkayOkayOkayOkayOkayOkayOkayOkayOkayOkayOkayOkayOkayOkayOkayOkayOkayOkayOkayOkayOkayOkayOkayOkayOkayOkayOkayOkayOkayOkayOkayOkayOkayOkayOkayOkayOkayOkayOkayOkayOkayOkayOkayOkayOkayOkayOkayOkayOkayOkayOkayOkayOkayOkayOkay,0.0,0.0,0.0,0.7017098069190979,0.0,0.0,0.0,0.7223737835884094
450,They will let you get numbers of friends and everything out of your phone.,I don't want to have anybody. Please.,I,You're you're you're you're you're you're you're you're you're you're you're you're you're you're you're you're you're you're you're you're you're you're you're you're you're you're you're you're you're you're you're you're you're you're you're you're you're you're you're you're you're you're you're you're you're you're you're you're you're you're you're you're you're you're you're you're you're you're you're you're you're you're you're you're,0.2222222222222222,0.0,0.054945054945054944,0.843313992023468,0.0,0.0,0.0,0.7126057147979736
452,You were just at a friend's house. You have to know people.,"Yeah, but I want the numbers.",YouYouYouYouYouYouYouYouYouYouYouYouYouYouYouYouYouYouYouYouYouYouYouYouYouYouYouYouYouYouYouYouYouYouYouYouYouYouYouYouYouYouYouYouYouYouYouYouYouYouYouYouYouYouYouYouYouYouYouYouYouYouYouYouYouYouYouYouYouYouYouYouYouYouYouYouYouYouYouYouYouYouYouYouYouYouYouYouYouYouYouYouYouYouYouYouYouYouYouYouYouYouYouYouYouYouYouYouYouYouYouYouYouYouYouYouYouYouYouYouYouYouYouYouYouYouYouYou,You're you're you're you're you're you're you're you're you're you're you're you're you're you're you're you're you're you're you're you're you're you're you're you're you're you're you're you're you're you're you're you're you're you're you're you're you're you're you're you're you're you're you're you're you're you're you're you're you're you're you're you're you're you're you're you're you're you're you're you're you're you're you're you're,0.0,0.0,0.0,0.7293713092803955,0.0,0.0,0.0,0.7233070135116577
454,"Well, you will be any numbers you have in your phone, you'll be able to get out when you get there. So, please have a seat in the car.","Sir, please.",YouYouYouYouYouYouYouYouYouYouYouYouYouYouYouYouYouYouYouYouYouYouYouYouYouYouYouYouYouYouYouYouYouYouYouYouYouYouYouYouYouYouYouYouYouYouYouYouYouYouYouYouYouYouYouYouYouYouYouYouYouYouYouYouYouYouYouYouYouYouYouYouYouYouYouYouYouYouYouYouYouYouYouYouYouYouYouYouYouYouYouYouYouYouYouYouYouYouYouYouYouYouYouYouYouYouYouYouYouYouYouYouYouYouYouYouYouYouYouYouYouYouYouYouYouYouYouYou,You're you're you're you're you're you're you're you're you're you're you're you're you're you're you're you're you're you're you're you're you're you're you're you're you're you're you're you're you're you're you're you're you're you're you're you're you're you're you're you're you're you're you're you're you're you're you're you're you're you're you're you're you're you're you're you're you're you're you're you're you're you're you're you're,0.0,0.0,0.0,0.7210406064987183,0.0,0.0,0.0,0.7087686657905579
456,Please. I'm I'm not going to ask you again. Please have a seat.,"I I understand, but please, can you not make an exception, please? I promise I'll pick you up.",YouYouYouYouYouYouYouYouYouYouYouYouYouYouYouYouYouYouYouYouYouYouYouYouYouYouYouYouYouYouYouYouYouYouYouYouYouYouYouYouYouYouYouYouYouYouYouYouYouYouYouYouYouYouYouYouYouYouYouYouYouYouYouYouYouYouYouYouYouYouYouYouYouYouYouYouYouYouYouYouYouYouYouYouYouYouYouYouYouYouYouYouYouYouYouYouYouYouYouYouYouYouYouYouYouYouYouYouYouYouYouYouYouYouYouYouYouYouYouYouYouYouYouYouYouYouYouYou,Thankyou. Thank you. Thank you. Thank you. Thank you. Thank you. Thank you. Thank you. Thank you. Thank you. Thank you. Thank you. Thank you. Thank you. Thank you. Thank you. Thank you. Thank you. Thank you. Thank you. Thank you. Thank you. Thank you. Thank you. Thank you. Thank you. Thank you. Thank you. Thank you. Thank you. Thank you. Thank you. Thank you. Thank you. Thank you. Thank you. Thank you. Thank you. Thank you. Thank you. Thank you. Thank you. Thank you,0.0,0.0,0.0,0.7294729351997375,0.03846153846153846,0.0,0.04373177842565598,0.8153204321861267
458,I we are past that. I need you to sit in the car.,What what would I have to do?,IIEEOOOO,You're You're You're You're You're You're You're You're You're You're You're You're You're You're You're You're You're You're You're You're You're You're You're You're You're You're You're You're You're You're You're You're You're You're You're You're You're You're You're You're You're You're You're You're You're You're You're You're You're You're You're You're You're You're You're You're You're You're You're You're You're You're You're You're,0.0,0.0,0.0,0.7722938060760498,0.0,0.0,0.0,0.722200870513916
460,Nothing. The only the only thing that you could do to not go to jail tonight is not drive drunk. That's the only thing that would stop you from not going to jail tonight. Is not driving drunk.,I I wasn't trying to. I'm sorry. I wasn't trying to.,YouYouYouYouYouYouYouYouYouYouYouYouYouYouYouYouYouYouYouYouYouYouYouYouYouYouYouYouYouYouYouYouYouYouYouYouYouYouYouYouYouYouYouYouYouYouYouYouYouYouYouYouYouYouYouYouYouYouYouYouYouYouYouYouYouYouYouYouYouYouYouYouYouYouYouYouYouYouYouYouYouYouYouYouYouYouYouYouYouYouYouYouYouYouYouYouYouYouYouYouYouYouYouYouYouYouYouYouYouYouYouYouYouYouYouYouYouYouYouYouYouYouYouYouYouYouYouYou,I.,0.0,0.0,0.0,0.7115967869758606,0.13333333333333333,0.0,0.06451612903225806,0.8675684332847595
462,"I understand you weren't trying to, but you were.",But I wasn't trying to be drunk at all.,YouYouYouYouYouYouYouYouYouYouYouYouYouYouYouYouYouYouYouYouYouYouYouYouYouYouYouYouYouYouYouYouYouYouYouYouYouYouYouYouYouYouYouYouYouYouYouYouYouYouYouYouYouYouYouYouYouYouYouYouYouYouYouYouYouYouYouYouYouYouYouYouYouYouYouYouYouYouYouYouYouYouYouYouYouYouYouYouYouYouYouYouYouYouYouYouYouYouYouYouYouYouYouYouYouYouYouYouYouYouYouYouYouYouYouYouYouYouYouYouYouYouYouYouYouYouYouYou,YouYou YouYou You You You You You You You You You You You You You You You You You You You You You You You You You You You You You You You You You You You You You You You You You You You You You You You You You You You You You You You You You You You You You You You You You You You You You You You You You You You You You You You You You You You You You You You You You You You You You You You You You You You You You You You You You You You You You You You You You You You You You You You You You You You You,0.0,0.0,0.0,0.7027532458305359,0.0,0.0,0.0,0.7101191282272339
464,Okay. Please have a seat.,"And there's nothing I can do, sir.",YouYouYouYouYouYouYouYouYouYouYouYouYouYouYouYouYouYouYouYouYouYouYouYouYouYouYouYouYouYouYouYouYouYouYouYouYouYouYouYouYouYouYouYouYouYouYouYouYouYouYouYouYouYouYouYouYouYouYouYouYouYouYouYouYouYouYouYouYouYouYouYouYouYouYouYouYouYouYouYouYouYouYouYouYouYouYouYouYouYouYouYouYouYouYouYouYouYouYouYouYouYouYouYouYouYouYouYouYouYouYouYouYouYouYouYouYouYouYouYouYouYouYouYouYouYouYouYou,IICCCCCCCCCCCCCCCCCCCCCCCCCCCCCCCCCCCCCCCCCCCCCCCCCCCCCCCCCCCCCCCCCCCCCCCCCCCCCCCCCCCCCCCCCCCCCCCCCCCCCCCCCCCCCCCCCCCCCCCCCCCCCCCCCCCCCCCCCCCCCCCCCCCCCCCCCCCCCCCCCCCCCCCCCCCCCCCCCCCCCCCCCCCCCCCCCCCCCCCCCCCCCCCCCCCCCCCCCCCCCCCCCCCCCCCCCCCCCCCCCCCCCCCCCCCCCCCCCCCCCCCCCCCCCCCCCCCCCCCCCCCCCCCCCCCCCCCCCCCCCCCCCCCCCCCCCCCCCCCCCCCCCCCCCCCCCCCCCCCCCCCCCCCCCCCCCCCCCCCCCCCCCCCCCCCCCCCCCCCCCCCCCCCCCCCCCCCCCCCCCCCCCCCCCCCCCCCCCCCCCCCCCCCCCCCCCCCCCCCCCCCCCCCCCCCCCCCCCCCCCCCCCCCCCCCCCCCCCCCCCCCCCCCCCCCCCCCCCCCCCCCCC,0.0,0.0,0.0,0.7059324979782104,0.0,0.0,0.0,0.6802194118499756
466,"No, ma'am. Unfortunately, there's not.",Even if I somebody picks me up.,I,You're you're talking about like a DUI.,0.25,0.0,0.0684931506849315,0.8367774486541748,0.0,0.0,0.06097560975609756,0.8404960632324219
475,Fireball?,Yeah.,IIEIOOOPQRSTUVWXYZ1234567890,You're you're not talking to me.,0.0,0.0,0.0,0.7790697813034058,0.0,0.0,0.1851851851851852,0.8822770714759827
480,And then the tags expired in April and her license is five times suspended.,"Yeah, tell me this.",I,YouYouYouYouYouYouYouYouYouYouYouYouYouYouYouYouYouYouYouYouYouYouYouYouYouYouYouYouYouYouYouYouYouYouYouYouYouYouYouYouYouYouYouYouYouYouYouYouYouYouYouYouYouYouYouYouYouYouYouYouYouYouYouYouYouYouYouYouYouYouYouYouYouYouYouYouYouYouYouYouYouYouYouYouYouYouYouYouYouYouYouYouYouYouYouYouYouYouYouYouYouYouYouYouYouYouYouYouYouYouYouYouYouYouYouYouYouYouYouYouYouYouYouYouYouYouYouYou,0.0,0.0,0.0,0.8314840793609619,0.0,0.0,0.0,0.710570216178894
