start_time,speaker_label,transcript
21:14,Lauren,My knees are like this.
21:18,[Officer],"Okay, go ahead and stand here and we'll try the next one. Just stand right back on the box."
21:21,Lauren,"What's the point? Did I just fail that? Because if I fail that, I'm going to go to jail."
21:25,[Officer],It's not a pass or a fail. It's just all the observations.
21:28,Lauren,My legs are shaking.
21:30,[Officer],Do you want me to show you how to do it? And then you determine whether or not
21:33,Lauren,I said I can't do anything. My legs are shaking. I need to go back to the hospital.
21:38,[Officer],I'm going to ask you one more time. I'm going to ask you one more time. Do you or do you not want to continue?
21:42,Lauren,I need to go to the hospital. The hospital.
21:44,[Officer],"Okay, I'm not even going to attempt anymore."
21:46,Lauren,What is the last one? What is it?
21:48,[Officer],I'm not going to do it.
21:49,Lauren,Just what is it?
21:50,[Officer],Do you want me to show you how to do it?
21:51,Lauren,Sure. You want to continue? You can stand on this box.
21:54,Lauren,I don't know if I want to continue. I want you to understand that I'm not okay right now.
21:58,[Officer],"Stand on the box, feet together, arms down by your side. Just like this. Stay like that until I tell you otherwise. Do you understand? So what I want you to do when I tell you to, you're going to pick either foot up, your choice. Pick it up about 6 inches off the ground like you're putting your foot on top of a soda can. Your foot's parallel with the ground, leg straight out. You're going to look down at your foot, you're going to count out loud, 1001, 1002, 1003 until I tell you to stop."
22:20,Lauren,"14, 15, 16, 17."
22:26,Lauren,I can't do it.
22:27,[Officer],"Okay, I'm going to ask you to stop."
22:29,Lauren,Stop.
22:30,[Officer],"Oh, I said until I tell you to stop."
22:33,Lauren,I didn't understand that part. I don't I don't want to continue.
22:38,[Officer],"No, I said until I tell you to stop. Okay. If you want to go with this female deputy over here."
22:43,Lauren,Okay.
22:44,[Officer],I'm complete.
22:45,[Officer],"So Lauren, we're arresting you for DUI and you're resisting."
22:48,Lauren,DUI? No.
22:50,[Officer],"All right, get back in the square. I didn't get arrested for DUI. And I didn't have one. Lauren, you're not making this any better for yourself. But I didn't get in the square. Let's go get this done, okay?"
23:02,Lauren,Can you explain to me something?
23:04,[Officer],"Uh, you're under arrest for resisting arrest without violence and DUI with property damage."
23:09,[Officer],Let's go.
