start_time,speaker_label,transcript
00:02,[Officer],"Who are you, sir? Hello."
00:04,[Driver],What's up?
00:05,[Officer],What's the rush?
00:06,[Driver],"Um, I'm just trying to get to work. I have a personal training session."
00:10,[Officer],"So, you're doing 96."
00:13,[Driver],I was not aware I was doing 96. I had the cruise control set at 85.
00:18,[Officer],"I mean, okay, even let's give you the difference. Say you were doing 85, that's still 35 miles an hour the speed limit."
00:24,[Driver],I understand that.
00:24,[Officer],"But like I said, I I got you on radar doing 96."
00:27,[Driver],"Okay, what? So, when did you clock it?"
00:30,[Officer],"Right as you're coming over the crest of the hill. Okay, you're not."
00:32,[Driver],I'm not truck for a while and then you
00:35,[Officer],Truck truck was doing 74.
00:38,[Officer],"Okay. You were doing 96. I need your driver's license, registration, proof of insurance."
00:42,[Driver],"I don't have my physical driver's license. It's it's in the mail on the way to me. Um, I have a passport."
00:51,[Officer],"Okay, you can't drive a car then until you have your license on you."
00:55,[Driver],"Okay. Well, if you want to give me a ticket for that too, go right ahead, sir, but I'm just a girl trying to get to"
01:01,[Driver],Sorry.
01:02,[Officer],"Oh, you say that, but you're putting everybody else at danger, so I I don't think that attitude's going to help your situation, okay?"
01:07,[Driver],"The last time I was pulled over by a cop, they pulled over two people at one time in the middle of the road. So I'm sorry. And he came up to the car and put his hand on his gun. So I'm sorry if I seem a little out of out of sorts right now."
01:20,[Officer],"I got you. I'm not them. Obviously, I'm not done any of that stuff."
01:24,[Driver],"Yeah, that's not. Yeah, that's not."
01:26,[Officer],Do you have your registration paperwork?
01:28,[Driver],Yes.
01:29,[Officer],"All right, hang tight back with you in a few."
01:33,[Officer],"Take your time, take your time, ready."
01:44,[Officer],"All right, ma'am, I need you to hop out of the vehicle and come around to the back of your trunk with me."
01:47,[Driver],What?
01:48,[Officer],I need you to step out of the vehicle and come around back to your trunk with me.
01:50,[Driver],Why?
01:51,[Officer],Because we're going to take care of paperwork back here.
01:53,[Driver],What paperwork?
01:54,[Officer],The paperwork I'm about to provide you back here.
01:56,[Driver],"Okay, why?"
01:57,[Officer],Because I'm giving you an order to.
02:00,[Driver],I I just didn't know like I I don't know why I need to get out of the car. Why do I need to get out of the car?
02:08,[Officer],"Because I have paperwork to take care of and for my safety and for convenience, it's taking care of back here."
02:17,[Officer],"Hey, Shade, can you pull up here with me?"
02:21,[Passenger],"Can I get out as well, sir?"
02:22,[Officer],"No, ma'am."
02:24,[Passenger],Why?
02:25,[Driver],I just want to stand with
02:26,[Officer],"Okay, I I'm not going to have a bunch of people on the side of the Gandy Boulevard. It's a safety issue, okay? This isn't that big of a deal."
02:32,[Driver],"Sorry. If you're okay, if you're telling me this is not that big of a deal, if you physically see me that I'm like"
02:41,[Officer],"It's not that big of a deal, but you are making it a big deal. Yes. I'm asking her to simply do something that I ask people to do every day."
02:47,[Officer],And I told you it's because it's for my safety. This is where I conduct this type of paperwork at is at the back of your vehicle.
02:53,[Driver],I've never been asked to get outside of my car before.
02:55,[Officer],"Well, today you are."
02:58,[Driver],Sorry.
03:00,[Officer],"At this point, you need to step out of the vehicle because I am giving you an order to do so."
03:07,[Driver],Excuse me.
03:09,[Officer],"Right around back here, please."
03:14,[Officer],Want to turn the face me so I can explain some things to you?
03:17,[Driver],Sure.
03:17,[Officer],Fantastic. Your driver's license is suspended.
03:20,[Driver],It's not. I'm You failed to pay a traffic citation out of Pasco and they suspended it on the 19th.
03:21,[Officer],You failed to pay a traffic citation out of Pasco and they suspended it on the 19th.
03:24,[Driver],I had six months to pay that ticket. Your driver's license is actively suspended.
03:26,[Officer],Your driver's license is actively suspended.
03:28,[Driver],The person told me that I had six months to pay that ticket. I actually reinstated my license a few months ago. Got that handled.
03:38,[Driver],And now you're telling me that my license is suspended and I haven't received notification of this.
03:44,[Driver],"And I know this isn't your fault, sir, but I haven't been going through a lot lately."
03:50,[Officer],"So I understand all that, but here are the simple facts today, okay? You don't have a license on you. It's the system, which is real time."
03:57,[Officer],"It is showing us suspended and that's what I have to go by. If there's a clerk or something like that, that is something that you're simply going to have to take care of at a later date in court."
04:06,[Driver],So what happens now?
04:07,[Officer],So I'm about to issue some notices to appear for court in lieu of making a physical arrest and taking you to jail because I don't want to do that.
04:13,[Officer],"All right, but you can't drive this car. If she has a valid license, she's the one that needs to take over, but she'll take over for you."
04:18,[Officer],"But you're going to have a court date that you're going to have to appear for, okay? The court date is going to get mailed to you. You're going to have a court date for driving with suspension and for your speed for doing 96 in a 50."
04:31,[Officer],"If you don't hear anything from the court in the next 30 days, the recommendation I tell everyone is, make sure you call the County clerk of court because you miss this court date for any reason, they will issue a warrant for your arrest, okay?"
04:44,[Officer],"I'm going to need a couple of things from you. First is going to be a signature at the bottom of both these citations next to the blue X. It's not admission of guilt, simply saying you're aware you're going to receive a court date in the mail and you promise to appear for it."
04:56,[Officer],"All right, I'm going to go ahead and crumple these up. I'm going to go print out a new copy. If you don't properly sign the citations, ma'am, I will be forced to make a physical arrest, okay? So I'm going to give you one more opportunity to comply."
05:07,[Driver],"You physically saw me sign those, correct? And that counts as a signature, correct?"
05:12,[Officer],"No, that's not a signature."
05:14,[Driver],"Anything from pen to paper, you physically see me sign, that is my signature. It does not have to be legible."
05:20,[Officer],Okay.
05:22,[Driver],"You have nothing else to say. It's not a signature, says who?"
05:27,[Officer],Okay. He's trying to work with you. I don't know why you're not. Why are you interrupting?
05:30,[Driver],I'm right now. And you made me get out of the car. You handed them to me and I could have signed them in the safety of my car.
05:39,[Officer],"You want me to say something and then you interrupt me, so I'm not going to say anything."
05:45,[Driver],"You don't even allow my wife to get out with me. Like, are you kidding me?"
06:04,[Officer],"All right, ma'am. So again, your signature is as it appears on your driver's license. This is not admission of guilt. This is simply an acknowledgement that you're aware you're going to receive a court date in the mail."
06:12,[Driver],I got this 10 years ago.
06:13,[Officer],"So, simply just need your compliance."
06:18,[Driver],Do you want to see my actual signature?
06:21,[Officer],"All right, go ahead and turn around, please, hands behind your back for me."
06:23,[Driver],"I'm not, please, baby!"
06:27,[Officer],Stay there. Stay there. Stop. Stop.
06:34,[Officer],Stop.
06:37,[Officer],"1061015, I got to get a cage cruiser."
06:48,[Driver],Why are you doing this to me?
06:49,[Officer],I will talk I'll talk to you in a second.
06:51,[Driver],"Please, stop. Please, stop."
07:01,[Officer],Tell him to step it up.
07:02,[Officer],"Yeah, 10-4, I need a cage cruiser. They can expedite. I'm being uncooperative."
07:05,[Driver],"Please, please, please, baby!"
07:09,[Driver],I love you. I'm trying to tell him to leave me alone.
07:15,[Officer],"No, you didn't."
07:16,[Driver],"Yes, I did!"
07:17,[Officer],"No, you didn't."
07:18,[Driver],He was a simple thing you had to do.
07:20,[Officer],It was a simple thing you had to do.
07:22,[Driver],I did it!
07:24,[Officer],"Ma'am, please do me a favor, have a seat in the vehicle. I don't want you to get injured."
07:27,[Driver],"Please, baby! Please, baby! Why are you doing this to me?"
07:43,[Driver],"Please, please, please, please, stop."
07:51,[Officer],I told her what you got to do is sign your paperwork.
07:53,[Officer],I got the paperwork done. She just refused to sign it.
07:56,[Driver],"No, I'm not. If you do see it, there's a signature on that paper, sir."
08:00,[Officer],That's not your signature.
08:01,[Driver],It is my signature.
08:02,[Officer],"Stop, stop, stop, stop, stop."
08:06,[Driver],I'm dying. I'm dying with the anxiety.
08:12,[Driver],"Can you please go look at the piece of paper I signed it? Please, they're making a big deal out of this. Please."
08:24,[Driver],"Please, please, please, please."
08:40,[Officer],Do you have your driver's license on you?
08:42,[Driver],"I'm sorry. This this is not that. Hold on, I got to talk. Hold on, I have to talk to a police officer. Give me just a second."
08:50,[Officer],Start walking back.
08:51,[Driver],"No, please, no!"
08:55,[Officer],Get in the car.
08:58,[Driver],I signed the paper.
09:02,[Officer],Get in the car.
09:07,[Driver],"Come on. Can I please have my wife? Please. Please, can I have my wife? Please."
09:17,[Officer],She can't take that.
09:18,[Driver],"Okay. Thank you, sir."
09:24,[Officer],She's got a chain and a couple bracelets on.
09:26,[Officer],"So here's the deal. Here's what happened, okay? She has a suspended driver's license and she's doing a speed of more than 30 miles an hour of the speed limit. In the state of Florida, one of those, the suspended driver's license is an arrestable offense. The other one is a mandatory appearance in court."
09:40,[Driver],Can you please?
09:41,[Officer],Have a seat. Get in the car.
09:50,[Officer],"When I placed down and explained this to her a second time, she again scribbled all over the citations. At that point, she's not acknowledging that she's going to appear in court. I cannot release her on a citation. So she has to go to jail and appear for those charges now."
10:04,[Driver],"Please, please."
10:08,[Officer],Thank you.
10:08,[Officer],No problem.
10:11,[Officer],"It's going to be a walk-through type of thing in and out. Now they're not going to hold her, okay? All right."
10:16,[Driver],Thank you.
10:19,[Driver],All I wanted to do was go work out this morning.
