start_time,speaker_label,transcript
21:56,Narrator,"Despite what she told Johnny, the video she's about to see clearly shows that Messiah was in the front passenger seat."
22:02,Detective,"Okay, so I'm going to kind of skip forward on the security talking about this. Um, I'm not making any questions or making any um requests of you, but I'm just going to let you know about the traffic."
22:14,Detective,There's no question about what we have.
22:17,Jonathan Johnny Overbay,I don't got no one on one question.
22:19,Detective,You're going to have to watch it.
22:22,Jonathan Johnny Overbay,"Yeah, I'm going to start."
22:26,Detective,Sorry.
22:28,Johnny's Aunt,It like glitch. Oh my gosh.
22:32,Johnny's Aunt,He said somebody got hit and then they end up dying.
22:35,Detective,Right.
22:37,Johnny's Aunt,And then I guess I don't know if somebody said you were there or what.
22:42,Jonathan Johnny Overbay,You need to tell me.
22:43,Johnny's Aunt,Like that's what they're trying to get me for.
22:45,Jonathan Johnny Overbay,That's why you won't see me.
22:54,Johnny's Aunt,"Dang it. It's just stop. Thank God because I didn't want to see that. If it's what, oh my gosh."
23:00,Detective,She's downloading it so that it doesn't have to rely on a bad connection. So it will still you guys will still watch it.
23:10,Jonathan Johnny Overbay,Why am I to worry about because I wasn't there.
23:13,Johnny's Aunt,"And he said, um, he's sorry that if he would have known, he didn't really know. He said it was a kind of last minute and they just popped up. And he said sorry because he wished that he could have warned you or told you more before he did that."
23:26,Narrator,"After downloading the video, the detective attempts to play it for Johnny and his mother one more time."
23:31,Johnny's Aunt,"It just sucks not knowing too. You know, that."
23:35,Detective,"Okay, here you go."
23:37,Johnny's Aunt,Oh my gosh.
23:38,Detective,Here you go.
23:42,Jonathan Johnny Overbay,Are you?
23:43,Johnny's Aunt,My phone is.
23:44,Jonathan Johnny Overbay,Yeah.
23:45,Johnny's Aunt,Are you?
23:46,Detective,There we go.
23:48,Detective,There we go.
23:51,Johnny's Aunt,Are you?
23:52,Detective,There we go.
23:54,Messiah,"Just bump in, bruh."
23:58,William Will Garcia,Like you like bump him?
23:59,Messiah,"Yeah, just bump him. Go like go like 15, 20."
24:07,Johnny's Aunt,I think that might drive.
24:14,Johnny's Aunt,Can we watch it again?
24:15,Detective,No.
24:16,Narrator,Another video recovered from Messiah's Instagram records show the teens' callous reaction to the blood on the car's hood.
24:22,Messiah,"Look, look where I hit her."
24:27,Messiah,Her whole face went boom.
24:28,Narrator,"The detective lets Jonathan's mom know he'll be taking his phone, explaining that it'll allow them to triangulate his location during the time of the incident."
24:36,Detective,"They have a DNA warrant, fingerprint warrant, um, for him because we have evidence from the vehicles that were utilized during this time frame. So, that was just a statement to let you go because I can hear you're kind of talking about it, so you're not like."
24:52,Johnny's Aunt,That's why.
24:52,Detective,Yeah.
24:53,Johnny's Aunt,"Because I were excited because we were like, what is going on? Because he's been out of jail. He was in jail for a long time and then he got out and he's been doing everything he needs to do and."
25:03,Detective,"So, there was um, vehicles involved and they they have um, evidence from them. So, once those DNAs, we'll be cross-examining his DNA and prints to the stuff collected from those vehicles."
25:17,Narrator,"Curious about his current probation, detectives ask for more details."
25:22,Johnny's Aunt,He had broken into a school or something. He's been doing restitution and stuff like that.
25:28,Detective,"Yeah, this will unfortunately, that's going to violate that, so."
25:33,Johnny's Aunt,"All right. Um, okay."
25:36,Johnny's Aunt,"I wish that I couldn't meet you, but I'm going to get to lot of."
25:42,Johnny's Aunt,I love you.
25:43,Jonathan Johnny Overbay,I know.
25:44,Johnny's Aunt,I'm sorry.
25:45,Jonathan Johnny Overbay,I know.
25:46,Johnny's Aunt,I'm sorry.
25:47,Johnny's Aunt,Are you going to be okay?
25:49,Jonathan Johnny Overbay,I know.
25:50,Jonathan Johnny Overbay,It's the most I can do.
25:51,Narrator,"An officer enters the room to take Johnny to his holding cell, leaving his mother in an emotional state."
25:58,Johnny's Aunt,"Um, yeah, we'll go to say bye and then we'll."
26:08,Johnny's Aunt,I'll be happy.
26:10,Johnny's Aunt,Just remember what happened last time you went in and try to learn from you like everything and.
26:16,Johnny's Aunt,"Don't let nobody fool you, but I'm going to get to the bottom, okay?"
26:21,Johnny's Aunt,"Be nice, be cool."
26:23,Johnny's Aunt,I need to find your glasses.
26:24,Jonathan Johnny Overbay,My double chin.
26:26,Johnny's Aunt,Yeah.
26:31,Johnny's Aunt,I'm sorry.
26:32,Jonathan Johnny Overbay,I'm sorry.
26:34,Johnny's Aunt,I love you.
26:35,Jonathan Johnny Overbay,No.
26:36,Officer Benavidez,"All right, they said you could be in there without cops, okay? So we'll keep it that way as long as you stay cool, okay?"
26:40,Jonathan Johnny Overbay,Love you.
26:41,Narrator,"Before entering his cell, Johnny is allowed one last goodbye hug with his mom."
26:49,Johnny's Aunt,"Be strong, okay?"
26:50,Johnny's Aunt,Best friend.
26:54,Johnny's Aunt,I love you.
26:55,Johnny's Aunt,Just.
26:58,Johnny's Aunt,Best friend.
27:04,Narrator,"Arrest warrants were obtained for Jonathan and William, and a search warrant was executed for Messiah. DNA and fingerprints were collected from all three boys for comparison with evidence recovered from the stolen car. On March 21st, 2025, Crime Stoppers received a shocking tip from a teacher who revealed that a fourth teen was present in the vehicle at the time of the murder. The tipster recognized the voice saying, bump him, as their student, none other than Will's best friend, 15-year-old Elijah Eli Ingleking, who had previously denied any involvement when questioned by investigators."
27:37,Messiah,"Just bump in, bruh."
27:38,William Will Garcia,Like you like bump him?
27:39,Messiah,"Yeah, just bump him. Go like go like 15, 20."
27:42,Narrator,"Investigators would later receive information from a third party, stating that Will's own brother shared that his parents knew Elijah was in the vehicle, but were waiting to disclose the information in the hopes of gaining leniency for Will. 15-year-old Elijah Ingleking was indicted by a grand jury on June 11th, 2025 on charges of first-degree murder, conspiracy to commit first-degree murder, and knowingly leaving the scene of an accident resulting in death. He entered a plea of not guilty and is currently being held without bond until his trial. Following his interview, 13-year-old Jonathan Overbay was taken to the juvenile detention center and later charged with first-degree murder, conspiracy to commit first-degree murder, leaving the scene of an accident involving great bodily harm or death, and unlawful carrying of a handgun by a person under the age of 19. According to the Bernalillo County District Attorney's Facebook page, he later pleaded guilty to second-degree murder, receiving the maximum juvenile sentence permitted under New Mexico law. He will remain in a juvenile facility until he reaches the age of 21. 15-year-old William Garcia was charged with first-degree murder and conspiracy to commit first-degree murder. Per our conversation with the District Attorney's office, his case has been transferred to adult court. As for Messiah, the 11-year-old was fed McDonald's and slept on a cot overnight in the interrogation room, as the Children's Youth and Family Services Department had no beds available for the night. He was taken into custody of CYFD the following morning. A recent Facebook post from the Bernalillo County District Attorney's office announced that a now 12-year-old has been charged with an open count of murder in connection with the death of Scott Habermel. We contacted the Second Judicial District Attorney's office to confirm whether this individual is Messiah, but were told they could not provide additional details at this time. If you'd like to see select new videos early and help us keep uncovering case files that rarely come to light, you'll find extra footage and unseen details on our Patreon. Channel memberships here on YouTube also include early access to select new videos."
