start_time,speaker_label,transcript
23:39,Detective,Was that what he was doing? Proselytizing to you about his beliefs?
23:45,Douglas Taylor,"Strangely, yes. Man trying to start a new cult. Not the right idea. Tries to reduce all of the world religions to some German mythology. Makes us think like people who understand some mysterious concept are the true rulers of all the different nationalities, religions and peoples. And so I'm like, oh, here's a young retard Hitler."
24:23,Narrator,"As the interrogation comes to an end, the detective has one final question for Douglas."
24:28,Detective,"After stabbing a guy like this, what do you think would be the right thing to do with you? What do you think the the the police, the law, the judges, you know, all these people who sit and make decisions about all this, what do you think's the right and appropriate thing to do?"
24:53,Douglas Taylor,"Not sure. Um, jail and prison."
25:03,Detective,Do you think that's the right thing for you?
25:05,Douglas Taylor,Yeah.
25:06,Narrator,"But if the detectives thought that this would be the last they'd hear of the man, they were in for a shocker. On October 12th, 2021, over a year and a half after the incident, Detective Schwikt received a handwritten letter from Douglas, while he awaited trial. In the letter, Douglas claimed that he didn't kill Hans and alleged that his old roommate Aaron is the one who killed Hans. Douglas reports that he heard a sound, entered the house, and saw Hans on the floor in his blood. He then went back outside where he alleged that Aaron threatened him and gave him a jacket with some blood on it. After being supposedly traumatized by the event, Douglas claimed to have agreed to take the blame and made a false confession later. When Detective Schwikt interviewed Aaron, he found him to be completely innocent with no involvement in the crime whatsoever. Not long after his arrest, Douglas Taylor entered into the Idaho Security Medical Program, but on October 13th, 2020, after almost four months in the program, doctors declared him fit to stand trial. Then on December 15th, 2021, Douglas Taylor pled guilty to murder in the first degree and was sentenced to 27 years to life on February 14th, 2022. Douglas is currently incarcerated at the Idaho State Penitentiary."
