start_time,speaker_label,transcript
00:00,Officer,"Hey, put your hands out the window."
00:02,Mason,"Which one is it, Mason?"
00:03,[Unidentified individual],I have no idea.
00:04,Sergio,I don't have an ID right now.
00:43,Dispatch,Hello.
00:50,Sergio,This car is not.
00:57,Dispatch,"760, we got a five with an occupied 2018 vehicle. Alexander."
01:10,Officer,Hello.
01:15,Sergio,Hello. Hello. What are y'all doing?
01:19,Officer,What are y'all doing?
01:20,Sergio,"Oh, I."
01:21,Officer,Do what?
01:22,Sergio,I think my girlfriend.
01:24,Officer,What do y'all live?
01:25,Sergio,Okay. You got IDs?
01:27,Officer,You got IDs?
01:30,Sergio,I don't have an ID right now.
01:33,Officer,Do you have a passport or anything with you?
01:35,Sergio,"Right now, I probably not."
01:37,Officer,You can take it off.
01:39,Sergio,I know how to say. I run the car with my people.
01:49,Officer,Okay. Have you ever had an ID in the states?
01:52,Sergio,"Yeah, I have one."
01:53,Officer,In United States you do?
01:55,Sergio,Yeah. I got it in 2006. I got it one ID.
02:05,Officer,So you did have an ID from Alabama?
02:06,Sergio,Yeah. Right now it's expired.
02:08,Officer,"Okay, that's fine. Yeah, okay. You want my number?"
02:10,Sergio,"Yeah, you know it?"
02:11,Officer,"Uh, Sergio."
02:13,Sergio,Say it again.
02:13,Officer,Sergio.
02:14,Sergio,Zero.
02:28,Officer,"Can you write your name and birth date on there too, please?"
02:32,Officer,"You said you know your license number, right? That you had earlier?"
02:35,Sergio,"Uh, this is my."
02:41,Officer,What's what's the license number?
02:44,Sergio,Oh.
02:46,Officer,You don't know it?
02:47,Sergio,Okay.
02:48,Officer,Who's car is this?
02:50,Sergio,"Oh, my sister."
02:51,Officer,Your sister?
02:51,Sergio,Yeah.
02:52,Officer,Okay.
02:58,Dispatch,"760, we got a 2018 vehicle. Alexander."
03:03,Officer,"All right, now we're just gonna see if we can find his name in the system. He said he had an ID a couple years ago from here. And so they're just out here talking. They'll supposedly live right down the road. They are outside of one of the closed businesses. Yeah, it's not gonna have a license to us. We're gonna go ahead and cut them loose. Just tell them to go back home, so they're not sitting outside of a closed business."
03:38,Officer,"All right, guys. All right. But uh, would y'all mind just going going home for the night? Just that way you guys aren't in front of a closed business for me. You're kidding me. All right. Yeah, I want you to uh, be careful with this dip right in front of you, okay? You probably want to go out that way. All right? All right. Thank you guys. You have a good night. Thank you. Thank you."
03:55,Officer,"Um, I got a call to come to somebody's residence because their kid needs some clothes at an elementary school and they can't get a hold of their mother, so. Hi, kitty, kitty. Hi, baby. Hi. Where are you? Hey, I'm looking for Anastasia."
04:21,Misha,Yes.
04:22,Officer,Are you her?
04:23,Misha,Yes.
04:24,Officer,"All right, your son, I guess needs some clothes at the school. I'm sorry. I guess they couldn't get a hold of you, so they sent me out here to."
04:32,Misha,"I gave them my mom's number. My goodness, which one is it, Mason?"
04:35,Officer,I have no idea.
04:35,Misha,Kindergarten.
04:37,Officer,Maybe.
04:37,Misha,Actually elementary.
04:38,Officer,Yeah.
04:40,Officer,"I'm so sorry. I don't mean to bother you. Do if you want to grab the clothes, I'll bring it to the school for you."
04:45,Misha,"Okay, okay."
04:46,Officer,"Yeah, go ahead. I'm sorry. I didn't mean to scare you."
04:54,Officer,"729, 1023. I brought um, a child at the elementary school. Some new clothes because he had an accident at the elementary school. And when I arrived at the house, mom had other young children inside, so I decided to just get the clothes and bring it to the elementary school instead of her packing up all the kids and um, going over to the the school. So, we dropped them off, so he can change and finish out school. And right now we're going to another call."
05:33,Officer,"So, Officer Daniel is responding to CVS in reference to suspicious package, uh, possibly containing narcotics. And we're going to see if we can assist him on this call."
05:47,Officer,"All right, so I was dispatched back here to CVS behind us in reference to a suspicious package. Arrived on scene and the employees complained that the package smelled like."
05:58,Officer,"At that time we notified a CIU investigator. Investigator Green, he came on scene, determined that the package was nothing illegal. Uh, the package was left on scene."
06:14,Dispatch,739.
06:16,Dispatch,"20278, 2811 Alpha 639."
06:25,Dispatch,71.
06:40,Dispatch,"760, we're still rolling, coming up to Oxmo. Speed is only 45."
06:47,Dispatch,71.
07:04,Dispatch,"Coming up to Oxmo, speed is 54. We got a vehicle coming."
07:10,Dispatch,71.
07:13,Dispatch,"720, Oxmo."
07:22,Dispatch,279.
07:26,Dispatch,County's in front of them. They got them coming to a stop. 760.
07:31,Dispatch,71.
07:34,Officer,I'm not stopping this.
07:36,Officer,"Hey, put your hands out the window."
07:41,Officer,Are there any other occupants?
07:43,Misha,"No, I don't know what I am. I just want to be safe."
07:48,Officer,I want to be safe right here.
07:53,Misha,I don't feel safe. I'm going to go to my mom. That's why I'm.
07:56,Officer,"No, ma'am, it does not work like that."
07:58,Misha,I don't feel safe. I'm going to go to my mom. I don't feel safe right here.
08:02,Officer,I don't feel safe right here.
08:03,Misha,"I can't get in it. Yes, ma'am. I get in it."
08:07,Officer,What's your name?
08:08,Misha,My name is Misha. I'm on the phone. I'm going to get out.
08:11,Officer,Step out of the vehicle.
08:13,Misha,Okay.
08:15,Officer,I need you to get out of to follow.
08:18,Misha,"Oh, okay. I am."
08:19,Officer,"Come step back here with me, okay?"
08:20,Misha,"Okay, I can walk."
08:21,Officer,"Come step. I'm not touching you. Come step back here with me, okay? Let's get out of the road."
08:27,Officer,Come step back here with me.
08:29,Officer,"Sit on this bumper right here, okay?"
08:33,Officer,Who are you on the phone with right now?
08:34,Misha,"We 911. Ma'am, I do not."
08:35,Officer,"Okay, well, we are 911, so you can hang up."
08:37,Misha,No lights and nothing.
08:39,Officer,I need you to follow the officer's instructions.
08:41,Misha,"Okay, I will."
08:43,Misha,Like y'all was behind me for the longest. Why did y'all not?
08:45,Officer,"With lights and sirens, exactly. Yeah."
08:47,Misha,Why? I don't feel safe right here.
08:50,Misha,We was just by a damn gas station right here.
08:53,Officer,"Okay, well, why did you not decide to pull over right there? And we had like three or four different turnouts."
08:56,Misha,"No, y'all did not have your lights on."
08:58,Officer,"Okay, well, we have cameras everywhere on my vehicle. So does my body camera that say otherwise."
09:02,Misha,You did not pull me over until we got over here. I'm not lying. I'm not.
09:04,Officer,Is your ID in your vehicle?
09:06,Misha,"Um, I believe it is."
09:08,Officer,Would you mind if I go in there and grab it?
09:09,Misha,"Yeah, the top. The little push down right here."
09:12,Officer,In the top?
09:13,Misha,"Yes, right here."
09:14,Officer,In the center in the top?
09:15,Misha,"Yeah, that's why I'm pulling me over."
09:17,Officer,"Hey, you mind grabbing that, Huey? It's in the top center."
09:20,Officer,"I pulled you over because you came out of your lane multiple times, okay? I wanted to make sure you're okay."
09:24,Officer,"Your travel lane, you see these white painted lines and the yellow painted lines right here? You came out of those lines, okay?"
09:34,Officer,Do you have insurance? Is it in there as well?
09:36,Misha,"No, it's on my phone."
09:37,Officer,"Okay, you mind pulling it up on your phone for me?"
09:41,Misha,"My God, they're on my ass when I was coming up the road. Like, what's going on?"
09:45,Officer,"Okay, and I didn't want to stop you in the middle of an intersection, so that's why I waited to hit my blue lights right there."
09:48,Misha,I don't feel safe right there.
09:50,Officer,You would have been safer to stop when I let you up than right here.
09:54,Misha,Why you see this light? I don't see no lights over here.
09:58,Officer,You don't see all those lights right there?
10:01,Misha,Where?
10:02,Officer,"Can you pull up your insurance on your uh phone, please?"
10:05,Misha,"Like, y'all got to be for real."
10:11,Officer,Where are you headed to tonight?
10:13,Misha,I'm going to get me something to eat. I'm going to the bank.
10:16,Officer,You getting something to eat or you going to the bank?
10:17,Misha,Both.
10:18,Officer,Both? Okay. Where are you coming from?
10:26,Officer,You know where you're coming from?
10:27,Misha,You can go get my address. You can see where I'm coming from.
10:30,Officer,I know where your address is. I just don't know if you're coming from there or not.
10:36,Misha,"Like, I really should have brake checked y'all how y'all was on my ass on that other road."
10:40,Officer,That wouldn't have went well for you.
10:42,Misha,I don't care. Don't drive on my ass like that. I thought y'all were random damn car.
10:45,Officer,"If you wouldn't have caught my attention with your tag cover and you coming out of your designated travel lane, then I probably wouldn't have been where I was, right?"
10:50,Misha,I was not coming out my lane. You can stop that.
10:52,Officer,"Well, we got cameras on the vehicle that say otherwise."
10:54,Misha,We can play the back. I know I wasn't.
10:55,Officer,"Okay, we will. It's okay."
10:57,Misha,I got it.
10:59,Misha,"Like, I don't want to feel safe."
11:07,Misha,"Well, I'm sorry. I'm just so pissed. Like, I'm so sorry. I'm just pissed."
11:13,Misha,When I had just passed Jevron. Y'all could have got me right there. Now why you trying to turn this road?
11:19,Officer,"That's just like you said, you want to wait for the best place to stop."
11:22,Misha,"Okay, which is what? Downstream a little bit more."
11:24,Misha,"I understand that, but I wasn't trying to like, you know, fly and get rid of it. I know. I put my lights on for a reason. Cuz they said it's the best thing to do when you don't feel safe."
11:36,Officer,"Sitting on uh Highway 202, we observed this vehicle pass us. Um, I got behind her. She does have a tag cover, uh, which in Alabama you cannot have anything that obstructs your tag, which hers is blocking half of the top of her state. Uh, she also came out of her designated travel lane, uh, multiple times. We initiated a traffic stop at um Highway 202 and 78, which is probably about a mile, mile and a half behind us. Is where we initiated the stop. Uh, she continued rolling until here and honestly probably would have kept going for a good while had County not gotten in front of her and slowed her vehicle down to a stop. Uh, she said she wanted a safe lit place. Um, where I lit her up at was out of the middle of an intersection. She had plenty of opportunity to pull over in lit areas. Uh, as soon as we got her stopped, gave her commands, put her hands out the window, she complied. Uh, she could see in the vehicle, she was the only one in there. She was on the phone with uh, Calin County dispatch, um, calling this in. I don't really know why because all they're going to do is uh, dispatch us out here anyway. She's obviously not happy, but uh, we're going to cut her a break. She technically could be going to jail for attempting to elude tonight. Um, we're just going to write her a ticket for the improper lane use. And uh, just advise her to stop next time she sees blue lights immediately that she doesn't get stay where to stop."
12:59,Misha,I don't know how they just got behind me. I was just on the line.
13:02,Officer,"Okay, ma'am. Here's what I did for you, okay? I'm cutting you a break. You could be going to jail tonight for attempting to elude, okay? Regardless of what you say, just hear me out. You're not just learning experience, okay? When you see blue lights, you're required by state law, you pull over the side of the road immediately, okay?"
13:15,Misha,What if we don't feel safe? We still got to pull over?
13:17,Officer,"Well, yes, ma'am. I stopped you with plenty of opportunity for you to pull over right there in lit areas and you decided to keep on rolling."
13:22,Officer,"Right at right at the intersection that I exactly. Don't walk in the road. There's a car coming. Don't walk in the road. Just stay over here. Stay over here. Okay? Just remember, there's lit areas back there, okay? You don't decide where to stop. If I let you up, obviously I wasn't going to let you up in the middle of an intersection, which is why I waited till we turned on the highway 78. You had plenty of opportunity to pull off just for the ride of you. You didn't even have to cross traffic, okay? Um, here's what I did. All I did was write you for the improper lane use, okay? I gave you plenty of time. I have your court date set out here for October 24th at 9:00 a.m. If you got any questions, there's a phone number right there you can contact. You come down to Oxford Police Department. Address is right there at the bottom. Do you have any questions about the citation?"
13:56,Misha,"And we can run this camera back, right?"
13:58,Officer,"Oh, yes, ma'am, absolutely. Um, also with your tag cover, make sure you take that off because you can't have anything obstructing the tag. You see where it's blocking half of this top and then has to be everything on the tag has to be plainly visible, okay?"
14:08,Misha,You know how long I had this?
14:09,Officer,"I know. A lot of people don't know that, okay? Had I not been explained that when I became a police officer, I probably wouldn't have known that either just being a civilian, okay? It's just just for just for your sake and ease, just take that off for me, okay? With that being said, is there anything in the vehicle should not be in the vehicle? Would you have a problem if I do a quick search real quick?"
14:27,Misha,"Oh, yeah."
14:28,Officer,Okay.
14:32,Officer,Do you smell anything on here?
14:33,Officer,"I don't smell anything, but there is a that was definitely."
14:38,Officer,"I saw her moving around, but I I I can't sit there and say I saw her moving around and she was grabbing that cuz she was on the phone with dispatch. I don't know if she was trying to grab her phone or what."
14:48,Officer,I don't know. I think she's calmed down now and she might be a little cooperative now.
14:51,Officer,You want to ask her if she was more or less confused or has some misinformation. Now there's shake all over down here.
15:01,Officer,"The magazine in here. There's no ammo in it, but there is a magazine."
15:07,Misha,I don't feel safe right here.
15:15,Officer,"And then again, just learning experience, okay? Uh, if we let you up, it's you got you got plenty of opportunity to pull over, okay? I know it probably probably just, you know, scared of police, but we're not we're not out to hurt people, okay?"
15:28,Misha,It's okay. I just like feel safe.
15:30,Officer,"I know. I know. Well, that's why I let you up back there. I was hoping you would pull over right there so we could, but um, like I said, just just learning experience, okay? Just keep all that in mind, okay? You're good to go, ma'am."
15:39,Misha,"Okay. And you have a good night and be safe, all right?"
15:41,Officer,"So, basically we let her up, uh, as I said earlier, and she did not stop. Uh, she stated she did not feel safe. Uh, the area I let her up in did have lighting and it was near a pretty busy intersection. Um, but it definitely better than where we stopped here. Uh, at the end of the day, uh, she was just she was just a little nervous and probably upset she's gotten stopped at 1:00 a.m. Uh, she got a ticket for the improper lane use. That was it. Um, as consent to search the car, we searched the car, found a torn baggy and a little bit of uh, residue in the passenger side floorboard. Um, again, I think she was just a little upset she got stopped. So, maybe that's a pretty good learning experience for her."
