start_time,speaker_label,transcript
00:00,[Narrator],"In January 2023, an officer was conducting routine patrol when he began following an SUV in Walkershaw, Wisconsin."
00:09,[Narrator],"The 30-year-old male driver named Rudolph had shown signs of potential impaired driving by swerving within his lane, drifting into the bike lane, and then abruptly swerving back to avoid a parked vehicle."
00:22,[Narrator],"When he began crossing the center line, the officer decided to initiate a traffic stop."
00:31,Officer Bacor,How's it going?
00:32,[Female Passenger],"Good, how are you?"
00:33,Officer Bacor,"Good. Officer Bacor, Walkershaw Police. Reason for your stop today is you were over the the line over here and then also you were in the bike lane coming down east. Any reason for that?"
00:42,Rudolph,"No, we were just trying to get home. Honestly, like the car in front of us, I felt like they were getting kind of close, but I understand why you, you know, why you were concerned and that's why I just like pulled over."
00:53,Officer Bacor,Okay. What was your reason for coming in here?
00:55,Rudolph,"Uh, it was it was honestly because like that car that was really close. I was like concerned and we have a newborn and I didn't want any complications, like honestly. You can look in the back, you can check all that and like honestly"
01:01,Officer Bacor,Concerned for what?
01:08,Officer Bacor,What do you mean by complications?
01:10,Rudolph,"No, what I meant by like I didn't want you to think that there was anything concerned. You know, we're trying to make it home and like her mom's literally waiting for us. She can show you all the ID and all that."
01:18,Officer Bacor,Okay.
01:21,Officer Bacor,Do you guys have IDs on you?
01:22,Rudolph,"Yeah, we do and it was just a it was a matter of like let's just get home safely. We're five minutes away."
01:27,Officer Bacor,"Okay. I hear you, boss."
01:29,Officer Bacor,Where are you guys coming from?
01:31,Rudolph,"Uh, right up the road."
01:32,Officer Bacor,"Do you have your license on you, boss?"
01:34,Rudolph,Yeah.
01:35,[Narrator],"While standing by the vehicle, the officer observed his speech was slurred and detected a strong odor of alcohol emanating from the vehicle."
01:42,Officer Bacor,Any weapons in the vehicle?
01:44,Rudolph,"No, not at all."
01:45,Officer Bacor,Any illegal drugs?
01:46,Rudolph,No.
01:47,Officer Bacor,How much alcohol have we had tonight?
01:48,Rudolph,"I think I had like Yeah, sir."
01:51,Officer Bacor,"Okay. How about you, boss?"
01:52,Rudolph,"Uh, probably less than her, but check my ID and it's just everything's good there. We're literally like"
01:58,Officer Bacor,How many how much did you have to drink is what I'm asking.
02:00,Rudolph,"Uh, probably one or two. Yeah, we also left at like"
02:03,Officer Bacor,One or two what?
02:06,Rudolph,At like 6:00 p.m. then.
02:08,Officer Bacor,You left at 6:00 p.m.?
02:10,[Female Passenger],Yes. Like we left my apartment.
02:13,Rudolph,Like we're literally just trying to make it down the street.
02:15,[Female Passenger],It's me.
02:16,Officer Bacor,Right. I I'm just wondering cuz you guys are saying you come come from the restaurant. I could smell intoxicants coming from the vehicle. So I'm just trying to see if you're safe to drive.
02:23,[Female Passenger],It's totally me.
02:24,Officer Bacor,"The reason why I stopped you is because you were going over the the line in the bike lane coming down East Avenue and then also the line over here. So that's why I'm trying to figure out. So how many drinks did you have, sir?"
02:35,Rudolph,"Um, I think probably like two. Like I"
02:40,Officer Bacor,Do you have a license on you?
02:41,Rudolph,Yes.
02:47,Officer Bacor,"All right, I want you guys to hang tight here, okay?"
02:50,[Police Officer],I'm going to run him through fields.
02:52,Officer Bacor,"Okay. The reason why I stopped him was he was like going a little bit over the bike lane coming down east. And then also when we turned on to sunset here, he was over the center line."
03:01,[Police Officer],"I'm going to run him real quick. Yeah, just do him here."
03:04,Officer Bacor,Nice and uh nice and flat.
03:08,[Narrator],"Upon running Rudolph's info, dispatch advised he had a revoked driving status."
03:14,Officer Bacor,"This means he's revoked, right?"
03:16,[Police Officer],"Through Illinois? Yeah, status revoked."
03:18,Officer Bacor,"Hit up the, she can confirm that."
03:19,[Police Officer],"I don't maybe she can do something more on her end too cuz it would it'd be nice to see if he's revoked for an OWI, you know what I mean? Is he up visiting?"
03:27,Officer Bacor,He's not making much sense.
03:29,[Police Officer],"Oh, really?"
03:30,Rudolph,"He's like, I'm just trying to get home. We have a baby at home."
03:32,Officer Bacor,"That was like, he's he's always dodging around my questions."
03:35,Rudolph,You have your ID. I have it on me.
03:37,Officer Bacor,"But anyways, we were just trying to get home. Oh, it's getting real evasive with his answers and trying to change your line of questioning."
03:44,Rudolph,Yes.
03:45,[Police Officer],How'd you guys end up over here?
03:46,Officer Bacor,"He pulled in. I was going to stop him. Then he pulled in and he started going all the way around. I was like, why'd you come over here? He's like, honestly, the car in front of me, I didn't want anything to do with them. I didn't want you guys to think I I was like, what what are you talking about?"
03:58,[Police Officer],"For six, go ahead."
04:00,[Police Officer],"For six, Rudolph, for four."
04:02,[Police Officer],10-4. Can you advise reason for revocation?
04:05,Officer Bacor,I want to find out if he's got prior OWIs through Illinois. I'll ask her later.
04:10,[Police Officer],"Yeah, you might have to do fields and ask after."
04:12,Officer Bacor,"Well, she's still working on that anyways, so I'm going to do it now."
04:20,Officer Bacor,"All right, Rudolph, so here's what's going on. Um, I'd like to make sure that you're safe to operate a motor vehicle. So I'd like to run some field sobriety tests on you. Is it okay?"
04:29,Rudolph,"Uh, when you talk to my wife about it."
04:32,Officer Bacor,"Well, I'm I'm going to do it regardless."
04:34,Rudolph,"No, it's okay. I just want to know what she thinks about it. Is it that's fine, right?"
04:38,Officer Bacor,"Well, she can she's"
04:39,Rudolph,"I just want to talk to her about it, right? That's okay."
04:42,Officer Bacor,What do you want to talk to her about?
04:43,Rudolph,Exactly what you said.
04:44,Officer Bacor,Sure. Go ahead. You can ask.
04:46,Officer Bacor,Keep the window rolled down.
04:58,[Bystander],just open the door.
04:59,Officer Bacor,It's locked.
05:02,Officer Bacor,"Hey, Rudolph. Hey."
05:04,Officer Bacor,Open the door.
05:05,Rudolph,"No, I was just I told you exactly what I was going to do."
05:08,[Police Officer],What was he saying?
05:09,Officer Bacor,"Let's let's do that now, okay?"
05:10,Rudolph,"Um, can I finish talking to her?"
05:13,Officer Bacor,"No, I'm telling you to get out of the vehicle right now."
05:15,Rudolph,Okay.
05:17,[Narrator],"As he displayed passive resistance, Rudolph quickly put the vehicle in drive and took off at a high rate of speed."
05:24,[Police Officer],44 can start us another one 1040 for now. He's possibly 55 locked himself in the door.
05:31,Officer Bacor,"Hey, down, no, no, no. No. No."
05:34,Officer Bacor,Put it in park. Put it in park now. He's taking off.
05:39,[Police Officer],We're shooting.
05:48,[Police Officer],46 we're going westbound on sunset. Passing Tenny.
05:52,[Police Officer],"Yes, sir, we're going eastbound. We're passing Gramling right now. He's at 97."
05:55,[Narrator],"After exceeding 100 miles an hour in a 35 mile per hour zone, he lost control of his vehicle, crashing into a tree before fleeing on foot."
06:04,[Police Officer],"Pulling in apartment complex, 1050."
06:07,Officer Bacor,"Foot pursuit, foot pursuit, foot pursuit."
06:12,Officer Bacor,"Stop, stop, do it now."
06:15,Officer Bacor,Police department.
06:17,Officer Bacor,Stop.
06:18,Rudolph,Oh my God.
06:20,Officer Bacor,Taser deployed.
06:21,Rudolph,Don't stop. Oh my God.
06:23,Officer Bacor,Roll over to your side. Do it now.
06:26,[Police Officer],We are across from Navajo right now in the apartment complex.
06:29,Officer Bacor,1026 we got the driver. Do not move.
06:32,[Police Officer],We'll stay with him.
06:33,Officer Bacor,One female passenger. The next squad can check on her.
06:36,[Police Officer],There's a car going on.
06:37,Officer Bacor,He can start at 1052. Unknown injuries at this time.
06:40,[Police Officer],Are you injured?
06:41,Rudolph,Do you want an honest answer?
06:42,[Police Officer],"Yes, I want an honest answer."
06:44,Rudolph,You really want an honest answer? You really want to know? I can give you this answer.
06:48,[Police Officer],He's cooperative now.
06:49,Rudolph,"No, I'm cooperating."
06:50,[Police Officer],But do you really Are you injured?
06:51,Officer Bacor,I'm asking you a question.
06:52,[Police Officer],All right. You good for now?
06:54,Officer Bacor,Did she run?
06:55,Rudolph,"No, she fell out."
06:56,[Female Passenger],"No, no, no, I fell out. Yeah."
06:57,Rudolph,I just want to see my daughter. I don't even know.
07:00,[Female Passenger],That's mine.
07:01,Rudolph,"Hey, thanks for not hitting me. Thanks for not hitting me."
07:05,[Female Passenger],Hello. I don't know.
07:06,Rudolph,Why are you laughing? This somebody was laughing.
07:08,Officer Bacor,Nobody's laughing.
07:09,Rudolph,I don't give a so you think I would deserve to die?
07:12,Rudolph,You okay? You think I deserve to die?
07:14,Officer Bacor,Are you injured right now?
07:14,[Police Officer],I got an ambulance coming.
07:16,Officer Bacor,"Do you need an ambulance, sir?"
07:17,Rudolph,"No, I don't."
07:18,Officer Bacor,Okay. Are you are you injured?
07:20,Rudolph,"No, no, no, I'm not."
07:21,Rudolph,Okay. Can you stand me up?
07:22,Officer Bacor,"Not right now. I'm going to have you chill here for a minute, okay?"
07:24,Rudolph,"Listen, I'm going to tell you what the situation is. You can take it however you want."
07:28,Rudolph,Okay. I know that you felt that I was under the influence and you weren't going to let me go.
07:33,[Female Passenger],No. It's right over there.
07:35,Officer Bacor,"I'm going to roll you over to my side, okay?"
07:37,Rudolph,Yep. I have water.
07:38,Officer Bacor,"No, not right now."
07:39,Rudolph,Can I ask you an honest question?
07:41,Rudolph,Sure. Are you new doing this for over a year?
07:44,Officer Bacor,You've been doing what for?
07:45,Rudolph,"No, have you been a cop for like doing this for over a year?"
07:47,Officer Bacor,I don't know if that's relevant.
07:48,Rudolph,"No, I'm just asking you. I really want to know."
07:51,Officer Bacor,I'm not sure.
07:52,[Female Passenger],"You're not sure. It's okay if you have. You're going to be okay. Okay. You were driving this has nothing to do with you, right? So can I help you up, please? This looks very uncomfortable. You can't move."
08:01,[Police Officer],All right. What hurts?
08:02,Officer Bacor,Are you injured? I'm asking him a question.
08:03,[Police Officer],Okay. Are you injured?
08:04,Officer Bacor,I was asking you a question.
08:05,Rudolph,"Can you No, no, I I will answer you. I will answer your question."
08:08,Officer Bacor,I'm asking you a question that's more important than how long he's been a cop. I'm asking if you're injured.
08:11,Rudolph,I can't say anything for you. I can answer it once I get that answer question.
08:15,[Police Officer],"Yeah, I'm not sure if he's going to be cooperative."
08:17,Rudolph,"No, I am. I am. I am. I'm going to be straight forward with you."
08:19,Officer Bacor,Okay. So are you injured? Are you going to answer the question?
08:22,Officer Bacor,"one more. Do you need to be checked out by an ambulance, Rudolph?"
08:24,Rudolph,Does that mean that I need to be checked out by an ambulance?
08:26,Officer Bacor,I'm asking if you're injured.
08:27,Rudolph,"Yeah, and I'm asking you what does that mean? Cuz I feel I'm in pain."
08:32,Officer Bacor,"Okay, where?"
08:32,Rudolph,I'm in pain in my entire body.
08:35,Officer Bacor,Okay. Does any part of your body hurt anything specific other than your whole body?
08:38,Rudolph,I can't tell because I'm in shock.
08:39,Officer Bacor,I know you're I know you're shaking. It's okay.
08:42,Rudolph,I'm not shaking. I can tell you.
08:43,Officer Bacor,Chilly outside.
08:45,[Police Officer],She uh she's a passenger. I think she's just in shock.
08:48,Rudolph,Can you ask me a question?
08:49,Officer Bacor,No. Do you remember what happened?
08:51,[Female Passenger],"Yes, he sped up at night. I I jumped out the car."
08:54,Officer Bacor,Why were you guys running?
08:55,[Female Passenger],He drank just a little.
08:57,[Female Passenger],Okay. And it wasn't as much as he thought. And we were sitting there forever and then he just said I have to go. He's not even a bad person. He's just
09:05,Officer Bacor,Nobody's saying he's a bad person.
09:06,[Female Passenger],"I know, but"
09:07,[Police Officer],"Wait, what did he just ask him?"
09:09,Officer Bacor,What did he just ask you?
09:10,Rudolph,"No, no, I can ask that, right?"
09:11,Officer Bacor,Walk. You can walk.
09:13,Rudolph,Why are you asking me questions?
09:15,[Police Officer],Bad water.
09:16,Officer Bacor,"No, we don't have any."
09:17,Officer Bacor,Sit down.
09:18,[Police Officer],I was like slow motion. Locked us out of the car. Locked us out of the car. Hand on the shifter. I just ran back to my car. I left him up there. I'm like it's about to take off.
09:27,Rudolph,Is there any way for that water?
09:29,Officer Bacor,"No, we do not have any water."
09:31,Rudolph,I see about getting some but you got to be cooperative.
09:33,Rudolph,"No, you can see about getting some."
09:34,Officer Bacor,What's in your mouth?
09:35,Rudolph,"Dude, I just fell on the floor. Like you can look."
09:38,Officer Bacor,Open your mouth and stick your tongue out. You got like dirt.
09:40,Rudolph,"No, yeah. You just figured it out. I'm just asking."
09:43,Officer Bacor,Okay. Take a seat and we'll figure it out.
09:45,[Police Officer],We don't have any right now.
09:46,Officer Bacor,That's okay. We'll work on getting it.
09:47,Officer Bacor,Just please sit down.
09:48,Rudolph,What's the time frame for that?
09:49,Officer Bacor,No time frame.
09:50,Officer Bacor,Are you going to be cooperative or not?
09:51,Rudolph,"No, are you going to hurt me? If I don't water."
09:53,Officer Bacor,"No, but sit down. Just sit in the car. You're not getting water right now."
09:56,Officer Bacor,Put your feet in.
09:58,[Police Officer],"Well, that took a turn."
10:00,Officer Bacor,Why does that matter?
10:01,[Police Officer],It was. That's why I had a I had a good view. I saw him put his hand on the shifter now. I don't know if you saw that.
10:05,Officer Bacor,"Well, I saw when you started going back. I was like, don't do it."
10:09,[Police Officer],"I did. I was like, I ran back."
10:11,Officer Bacor,"No, it's good. It's good."
10:12,[Police Officer],I knew what was happening.
10:13,Officer Bacor,You got to jump on him.
10:14,[Police Officer],Obviously we're into fields. Do you want to do them? I don't know if he'll be cooperative. What are you thinking?
10:19,Officer Bacor,It's changed a lot. Maybe he's in custody now. At least give him the opportunity.
10:23,[Police Officer],Firefighters like to talk to you.
10:24,Rudolph,Can I have water?
10:25,Officer Bacor,"We do not have water, unfortunately."
10:27,Rudolph,"Okay, what do you have to aid me here?"
10:29,Officer Bacor,We have an ambulance. We have medical staff. We can just say what what happened?
10:34,Rudolph,Okay. I can tell you right now that I know how the justice system works. I know how things go. And
10:43,Officer Bacor,"Okay, but what's going on with you? We're we're just paramedics. So we're we're we're here to help you with any medical needs."
10:48,Rudolph,"If you're here to help me, I need water."
10:50,Officer Bacor,And we don't carry water with us. That's We have any type of fluid.
10:53,Officer Bacor,Not not that we could give you.
10:55,Rudolph,Do you have any like any pain or injuries?
10:57,Rudolph,"No, I'm trying to tell you that I do."
10:59,Officer Bacor,"Okay, can you tell us that? I'm not going to give you water. So you can either tell us about your injuries."
11:04,Rudolph,The injuries that I have. I can't really talk about them because you're saying that you can't aid them.
11:10,Officer Bacor,So you're declining medical assistance.
11:12,Rudolph,I'm not declining medical.
11:13,Officer Bacor,"Okay, then tell us what's wrong."
11:14,Rudolph,"I'm asking for medical assistance. For what in the simplest version is I'm saying it's I need water. If you cannot provide me with that, I understand and I wish it wasn't that way, but like do you understand what I'm saying? Like I feel like right now medically, I need water."
11:30,Rudolph,"You tell me I can't I can't provide that to me. So unfortunately, like it looks like I'm going to have to suffer. I want that."
11:39,Officer Bacor,"Okay, yeah, we we it's not something that we we can take you to a hospital where they have water. Yeah, and that that would be what what we could do, but that's not that's not something that we would be providing to you."
11:49,Rudolph,And then what are the other options? Because like I don't want to die.
11:52,Officer Bacor,"Right, we won't let you die."
11:54,Rudolph,"Well, I don't know cuz like right now I'm saying I need water and it feels like it's, you know, dire, but you're looking me saying that you can't provide me with that. Like you can't provide me with a bottle."
12:05,Officer Bacor,"Right, cuz we don't carry that. That's not something that we we carry."
12:08,Rudolph,That's okay. I understand.
12:09,Officer Bacor,We have other means means of or means of giving you that if we feel that.
12:13,Rudolph,I understand. So what like how does that work?
12:15,Officer Bacor,"That would be like giving you an IV with fluids and things like that, but that might not quench your thirst. That might just"
12:22,Rudolph,"If I say that right now I need water and you just would like put me in some type of cell or some type of cage and you don't provide me with water. Yeah, like I can't I can't tell you that I'm going to be 100%."
12:33,Officer Bacor,"Look, you'll you'll get water soon. We we're I don't think I don't think you're you're getting it. We don't have any right now. You'll you'll get water in a little bit."
12:42,[Police Officer],Is that the only chief complaint you got though?
12:43,Officer Bacor,"Um, you doing okay right now?"
12:45,Rudolph,"You know, I'm not. I'm not doing okay mentally. It's tough for me."
12:49,Rudolph,All right. But I'm I'm trying to be honest with you.
12:51,Officer Bacor,"Okay. No, I'm saying we appreciate that. We appreciate your honesty."
12:54,Rudolph,"Yeah, like I know where I stand and I know what the situation is. And I know that I made a bad decision, but I'm trying to say that like realistically, I feel like I need some water."
13:03,Rudolph,You know what I'm saying?
13:04,Officer Bacor,"Yeah. We're going to get going for now though, okay?"
13:06,Rudolph,"Uh, yeah, so you're not too concerned with that."
13:08,Officer Bacor,"No, we'll get you water where we're going. We don't have water out here."
13:13,Rudolph,What's the timetable with that? Like 15 minutes?
13:15,Officer Bacor,All right. Are you just said?
13:16,Rudolph,Oh.
13:18,[Police Officer],Thanks for taking over. I would have had you guys going on.
13:20,Officer Bacor,You're good. You're good.
13:21,[Police Officer],I'm going the wrong way.
13:23,Officer Bacor,I would have jumped on the radio sooner. I'm freaking clicking my damn seat belt. I'm like trying to get this seat belt.
13:29,[Police Officer],"No, he he over his mouth. He's only got dirt in his mouth."
13:33,Officer Bacor,"Well, he took me through the pine trees. I'm right behind him. I like whack him in the face."
13:37,[Police Officer],How fast?
13:38,Officer Bacor,We're going 100 miles an hour.
13:39,[Police Officer],Last time I looked out was 97.
13:40,Officer Bacor,"Yeah. Oh, no, he was trying to turn in here. So he was slowing way down."
13:43,[Police Officer],"Oh, I was going to say I was like, you're up in that building right now."
13:46,Officer Bacor,"He was slowing way down. Just for your report purposes. I mean, he just fell asleep like snoring. Heavy odor. I I could he smelled up the entire squad, so."
13:55,[Police Officer],"Dude, I got a feeling my ankles and he's sore as hell tomorrow. I rolled it."
13:59,Officer Bacor,"He was like, where do you guys go? Cuz I I saw you guys go in there and then all of a sudden I hear it over here. I'm like running through the"
14:06,[Police Officer],"My first taser, nothing. Like I I heard it hit his wallet according to sober, but that second one locked him up."
14:14,Officer Bacor,"I was like, oh, great. All right, I'll meet you up there."
14:16,[Narrator],"When offered the option to undergo SFSTs or a breath test, he refused. Additionally, it was found that Rudolph had one prior OWI conviction in 2018."
14:28,Rudolph,"You guys are going to put me in jail. Right? Oh, yeah. And then what? Someone's going to have to bail me out."
14:34,Officer Bacor,It's not going to be bail on this one.
14:35,Rudolph,Why not?
14:36,Officer Bacor,Cuz it's felony.
14:37,Rudolph,Why is it felony?
14:38,Officer Bacor,Cuz you fled and eluded the police.
14:40,[Narrator],"As per the female passenger, just before Rudolph fled from the traffic stop, he uttered, I'm sorry. I have to say bye to"
14:48,[Narrator],She also expressed feeling scared during the pursuit and was considering jumping out of the vehicle.
14:56,[Narrator],"As a result, Rudolph was slammed with felony counts of vehicle fleeing eluding an officer, second degree recklessly endangering safety, OWI causing injury, prohibited alcohol content causing injury, misdemeanor counts of operating while intoxicated, third offense, resisting obstructing an officer, and operating with prohibited alcohol content, third offense."
15:19,[Narrator],"He received over $1,300 in traffic citations and was subsequently given a $5,000 cash bond."
15:26,[Narrator],"As of February 2024, Rudolph was found guilty of only two felony charges. Two counts were dismissed on the prosecutor's motion, and the remaining were dismissed but read in. In the end, he was sentenced to 18 months of initial confinement, followed by two years of extended supervision."
15:45,[Narrator],"Visit Codebluecam.com and treat your family, friends, and enemies with top-notch merch that is sure to impress."
