start_time,speaker_label,transcript
18:10,[Narrator],"According to investigative notes, Officer Staff then extends his right hand in the woman's direction, but what he does is not fully captured."
18:24,[Narrator],The body camera is then turned off for six minutes.
18:29,[Officer],So all the only thing that shows on these cameras is a little red dot that shows when your camera's recording.
18:33,[Interviewer],Yeah.
18:34,[Officer],And I do not recall it being on when we got to the ambulance.
18:37,[Narrator],"In footage from the incident, two of the female suspects arrived at the ambulance, while the one who was with Officer Staff was taken to a police cruiser."
18:45,[Narrator],"After she learned she was about to be arrested, she made an accusation against Officer Staff, but the other officers didn't seem to believe her."
18:54,Taylor Staff,"So not only you, okay, every single person."
18:56,[Woman in distress],"Okay, are we going to fight right now? Because you know what you were just throwing me."
19:00,Taylor Staff,Just stop.
19:02,[Woman in distress],There's going to be an issue because you were just.
19:04,Taylor Staff,Here's the deal. There's not going to be an issue.
19:06,[Woman in distress],"No, no, no. I will get a lawyer. I will get a lawyer. I will get a lawyer."
19:09,Taylor Staff,"Cool. All right, you're under arrest."
19:11,[Woman in distress],I will arrest because you're a lawyer.
19:14,Taylor Staff,Stop.
19:14,[Woman in distress],Really? He was just.
19:15,Taylor Staff,He wasn't. I was with him.
19:17,[Woman in distress],"No, you were not. You were not there when he was."
19:24,[Woman in distress],Are you kidding me?
19:26,[Woman in distress],Are you kidding me?
19:27,Taylor Staff,I got both.
19:28,[Woman in distress],You're just really all army.
19:30,[Woman in distress],This is police brutality.
19:33,[Woman in distress],Really?
19:34,Taylor Staff,"Yes, really. You're drunk."
19:35,Taylor Staff,You can't.
19:36,[Woman in distress],You stole my and everything.
19:38,[Woman in distress],This is he really did. I'm not even kidding.
19:40,[Narrator],One officer later recalled the victim saying something else to Officer Staff.
19:44,[Interviewer],What exactly did she say and how did she say it?
19:47,[Officer],"Uh, that's why I don't want to misquote, but it was."
19:50,[Interviewer],Did she say genitals?
19:51,[Officer],"No, uh, something along the lines of if said if I showed you my, I'd go home, not to jail."
19:57,[Narrator],"According to her later interview, it was after he shut off his body camera that Officer Staff put his hand down her pants and inside her underwear."
20:05,[Interviewer],"Without knowing actually what happened, what is your opinion? Do you think that this is something that he had the ability and capability and that he's the type of guy, like this, like does the shoe fit?"
20:16,[Officer],"I I would not say it's completely out of character. Um, I didn't like working with him. Like I don't like the way he is personally. Um, I've never had one of these complaints made against me and the fact that there's just multiple complaints coming against one person, it just seems to ring a little bit of a alarm."
20:32,[Officer],"He recently, there's been a couple more things come out since I've been speaking with these other officers and that's when we decided, you know, there's a lot of coincidences going on. So that's why we all wanted to come forward."
20:41,[Narrator],"On February 24th, 2021, the Illinois State Police arrested Officer Taylor Staff at his residence and transported him to the Sangamon County Jail, held on a $250,000 bond."
20:53,[Narrator],"Staff pleaded guilty to five charges as part of a plea deal, including aggravated criminal sexual abuse, custodial sexual misconduct, criminal sexual abuse, and two counts of official misconduct."
21:06,[Narrator],"He was sentenced to six and a half years in prison with credit for 998 days already served, followed by one year of supervised release."
21:16,[Narrator],He's also required to register as a lifetime sex offender.
21:20,[Narrator],"As a result of his felony convictions, Taylor Staff is effectively barred from ever serving in law enforcement again."
21:27,[Narrator],"If you'd like to see select new videos early, watch our content without censored and muted words throughout and see details we couldn't include here, you'll find extra footage on our Patreon."
21:38,[Narrator],Channel memberships here on YouTube also include early access to select new videos.
